{
  "__type": "V8_FULL_BACKUP",
  "exportTarihi": "08.01.2026 05:42:53",
  "storageDump": {
    "piyasa_state_v1": "{\"week\":2,\"sheet\":\"2.HAFTA \",\"loadedAt\":\"2026-01-08T01:50:32.646Z\",\"orders\":[{\"__idx\":1,\"firma\":\"CR6\",\"malzeme\":\"P05\",\"yuklemeTuru\":\"SİLOBAS\",\"aciklama\":\"\",\"il\":\"BALIKESİR\",\"miktar\":\"2.000 KG\"},{\"__idx\":2,\"firma\":\"HP3\",\"malzeme\":\"HP 0.15-0.60\",\"yuklemeTuru\":\"SİLOBAS\",\"aciklama\":\"\",\"il\":\"BOZÜYÜK                              \",\"miktar\":\"27.000 KG\"},{\"__idx\":3,\"firma\":\"HP3\",\"malzeme\":\"HP 0.15-0.60\",\"yuklemeTuru\":\"YENİ BBT\",\"aciklama\":\"\",\"il\":\"MERSİN\",\"miktar\":\"3X27.000 KG\"},{\"__idx\":4,\"firma\":\"HP3\",\"malzeme\":\"HP 0.15-0.60(615)\",\"yuklemeTuru\":\"YENİ BBT\",\"aciklama\":\"1.ARAÇ 30.12.2025 SALI GÜNÜ, 2.ARAÇ 02.01.2026 CUMA GÜNÜ SAAT 16:00 DAN ÖNCE TESLİM EDİLECEK ŞEKİLDE UZUN DORSE İLE SEVK EDİLMESİ RİCA OLUNUR.\",\"il\":\"GÖLBAŞI\",\"miktar\":\"2 X 27.000 KG\"},{\"__idx\":5,\"firma\":\"HP8\",\"malzeme\":\"HP 0.15-0.60\",\"yuklemeTuru\":\"SİLOBAS\",\"aciklama\":\"\",\"il\":\"ANKARA\",\"miktar\":\"27.000 KG\"},{\"__idx\":7,\"firma\":\"HP7\",\"malzeme\":\"HP 0.15-0.60\",\"yuklemeTuru\":\"SİLOBAS\",\"aciklama\":\"\",\"il\":\"ANKARA\",\"miktar\":\"27.000 KG\"},{\"__idx\":8,\"firma\":\"HP2\",\"malzeme\":\"HP 0.15-0.60\",\"yuklemeTuru\":\"DÖKME\",\"aciklama\":\"\",\"il\":\"GEBZE\",\"miktar\":\"4 X 27.000 KG\"},{\"__idx\":9,\"firma\":\"HP2\",\"malzeme\":\"HP 0.15-0.60\",\"yuklemeTuru\":\"SİLOBAS\",\"aciklama\":\"\",\"il\":\"ANKARA/BALA\",\"miktar\":\"27.000 KG\"},{\"__idx\":10,\"firma\":\"HP2\",\"malzeme\":\"HP 0.15-0.60\",\"yuklemeTuru\":\"DÖKME\",\"aciklama\":\"\",\"il\":\"TURGUTLU/MANİSA\",\"miktar\":\"5 X 27.000 KG\"},{\"__idx\":11,\"firma\":\"HP2\",\"malzeme\":\"HP 0.15-0.60\",\"yuklemeTuru\":\"DÖKME\",\"aciklama\":\"\",\"il\":\"ANKARA\",\"miktar\":\"2 X 27.000 KG\"},{\"__idx\":12,\"firma\":\"HP3\",\"malzeme\":\"HP 0.15-0.60\",\"yuklemeTuru\":\"YENİ BBT\",\"aciklama\":\"\",\"il\":\"SİVAS\",\"miktar\":\"27.000 KG\"},{\"__idx\":13,\"firma\":\"HP22\",\"malzeme\":\"HP 0.15-0.60(615)\",\"yuklemeTuru\":\"YENİ BBT\",\"aciklama\":\"\",\"il\":\"ANKARA\",\"miktar\":\"27.000 KG\"},{\"__idx\":15,\"firma\":\"HP9\",\"malzeme\":\"HP 0.15-0.60\",\"yuklemeTuru\":\"SİLOBAS\",\"aciklama\":\"\",\"il\":\"ESKİŞEHİR\",\"miktar\":\"27.000 KG\"},{\"__idx\":16,\"firma\":\"HP60\",\"malzeme\":\"H-150\",\"yuklemeTuru\":\"YENİ BBT\",\"aciklama\":\"\",\"il\":\"ELAZIĞ\",\"miktar\":\"27.000 KG\"},{\"__idx\":17,\"firma\":\"G12\",\"malzeme\":\"P2 (PB180-13)\",\"yuklemeTuru\":\"SP\",\"aciklama\":\"NAKLİYE HİZMET BEDELİ AYRI İRSALİYEDE KG CİNSİNDEN GİRİLMELİDİR.\",\"il\":\"GAZİANTEP\",\"miktar\":\"16.720 KG (836 ÇUVAL)\"},{\"__idx\":18,\"firma\":\"İ9\",\"malzeme\":\"P05\",\"yuklemeTuru\":\"DÖKME\",\"aciklama\":\"03.01.2026 CUMARTESİ GÜNÜ 08-09:00 CİVARI TESLİM EDİLECEK ŞEKİLDE ORGANİZE EDİLMESİ RİCA OLUNUR\\r\\n43 acy 486 Rıdvan tolu 0545 889 13 39 dorse 64 aag 596 tc 364 608 88 216\",\"il\":\"BOZÜYÜK\",\"miktar\":\"120 M3\"},{\"__idx\":19,\"firma\":\"HP34\",\"malzeme\":\"8 ADET SIFIR BİGBAG(10 TON) 1.20-2.80\\r\\n14 ADET SIFIR BİGBAG (17 TON) 0.60-1.40\\r\\n\",\"yuklemeTuru\":\"YENİ BBT\",\"aciklama\":\"8 ADET SIFIR BİGBAG(10 TON) 1.20-2.80 ÜRÜNÜNDEN, 14 ADET SIFIR BİGBAG (17 TON) 0.60-1.40 ÜRÜNÜNDEN YÜKLENMELİDİR\",\"il\":\"KOCAELİ\",\"miktar\":\"27.000 KG\"},{\"__idx\":20,\"firma\":\"HP13\",\"malzeme\":\"10 BBT HP 0.60-1.40(SERT)\\r\\n4 BBT HP 0.60-1.40(YUMUŞAK)\\r\\n10 BBT HP 0.15-0.60\",\"yuklemeTuru\":\"2.EL BBT\",\"aciklama\":\"10 BBT HP 0.60-1.40(SERT), 4 BBT HP 0.60-1.40(YUMUŞAK), 10 BBT HP 0.15-0.60 YÜKLENMESİ 06.01.2026 SALI GÜNÜ TESLİM EDİLECEK ŞEKİLDE ORGANİZE EDİLMESİ RİCA OLUNUR\",\"il\":\"İSTANBUL\",\"miktar\":\"30.000 KG (24 BBT)\"},{\"__idx\":21,\"firma\":\"DT1\",\"malzeme\":\"P1(PA160-8)\",\"yuklemeTuru\":\"DÖKME\",\"aciklama\":\"\",\"il\":\"İSTANBUL\",\"miktar\":\"10.000 KG\"},{\"__idx\":22,\"firma\":\"İ2\",\"malzeme\":\"P05\",\"yuklemeTuru\":\"DÖKME\",\"aciklama\":\"NAKLİYE FATURASI AYRI İRSALİYEDE KESİMLESİ RİCA OLUNUR.22-25 ARALIK TARİHLERİ ARASINDA TESLİM EDİLECEK ŞEKİLDE ORGANİZE EDİLMESİNİ RİCA EDİYORUZ.\",\"il\":\"MERSİN / SERBEST BÖLGE\",\"miktar\":\"3.050 KG\"},{\"__idx\":23,\"firma\":\"K1\",\"malzeme\":\"P2 (PB140-9)\",\"yuklemeTuru\":\"SP\",\"aciklama\":\"(SEVK İRSALİYESİNE SİPARİŞ NO: 158634 KALEM KODU: 010006036 SİPARİŞİ VEREN KİŞİ: EZGİ BEKTAŞ, BİLGİLERİNİ NOT EDELİM). ANALİZ SERTİFİKASINI ARAÇ İLE BİRLİKTE ÇIKARTALIM. İRSALİYE KESİLİRKEN TEK KALEM MALZEME OLARAK ÇIKIŞ YAPILMALIDIR. PALETİ VEYA BİGBAG AYRI KALEM OLARAK İRSALİYEYE GİRİLDİĞİNDE FİRMA KABUL ETMİYOR.\",\"il\":\"ADAPAZARI\",\"miktar\":\"3.500 KG\"},{\"__idx\":24,\"firma\":\"HP76\",\"malzeme\":\"HP 1.20-2.80\",\"yuklemeTuru\":\"YENİ BBT\",\"aciklama\":\"\",\"il\":\"GÖNEN\",\"miktar\":\"27.000 KG\"},{\"__idx\":25,\"firma\":\"HP13\",\"malzeme\":\"12 BBT HP 0.60-1.40(YUMUŞAK)\\r\\n12 BBT HP 0.60-1.40(SERT)\",\"yuklemeTuru\":\"2.EL BBT\",\"aciklama\":\"12 BBT HP 0.60-1.40(YUMUŞAK), 12 BBT HP 0.60-1.40(SERT) YÜKLENMESİ VE 08.01.2025 PERŞEMBE GÜNÜ TESLİM EDİLECEK ŞEKİLDE ORGANİZE EDİLMESİ RİCA OLUNUR\",\"il\":\"İSTANBUL\",\"miktar\":\"30.000 KG (24 BBT)\"}]}",
    "client_error_log": "[{\"ts\":\"2026-01-07T22:40:53.488Z\",\"type\":\"promise\",\"payload\":\"[object ErrorEvent]\"},{\"ts\":\"2026-01-07T22:40:53.488Z\",\"type\":\"error\",\"payload\":\"Script error.\"},{\"ts\":\"2026-01-06T21:24:38.265Z\",\"type\":\"promise\",\"payload\":\"[object ErrorEvent]\"},{\"ts\":\"2026-01-06T21:24:38.265Z\",\"type\":\"error\",\"payload\":\"Script error.\"},{\"ts\":\"2026-01-06T21:24:38.256Z\",\"type\":\"promise\",\"payload\":\"[object ErrorEvent]\"},{\"ts\":\"2026-01-06T21:24:38.256Z\",\"type\":\"error\",\"payload\":\"Script error.\"},{\"ts\":\"2026-01-06T21:24:38.246Z\",\"type\":\"promise\",\"payload\":\"[object ErrorEvent]\"},{\"ts\":\"2026-01-06T21:24:38.246Z\",\"type\":\"error\",\"payload\":\"Script error.\"},{\"ts\":\"2026-01-06T21:24:38.237Z\",\"type\":\"promise\",\"payload\":\"[object ErrorEvent]\"},{\"ts\":\"2026-01-06T21:24:38.237Z\",\"type\":\"error\",\"payload\":\"Script error.\"},{\"ts\":\"2026-01-06T21:24:29.609Z\",\"type\":\"promise\",\"payload\":\"[object ErrorEvent]\"},{\"ts\":\"2026-01-06T21:24:29.609Z\",\"type\":\"error\",\"payload\":\"Script error.\"},{\"ts\":\"2026-01-06T21:24:29.603Z\",\"type\":\"promise\",\"payload\":\"[object ErrorEvent]\"},{\"ts\":\"2026-01-06T21:24:29.603Z\",\"type\":\"error\",\"payload\":\"Script error.\"},{\"ts\":\"2026-01-06T21:24:29.596Z\",\"type\":\"promise\",\"payload\":\"[object ErrorEvent]\"},{\"ts\":\"2026-01-06T21:24:29.596Z\",\"type\":\"error\",\"payload\":\"Script error.\"},{\"ts\":\"2026-01-06T21:24:29.549Z\",\"type\":\"promise\",\"payload\":\"[object ErrorEvent]\"},{\"ts\":\"2026-01-06T21:24:29.549Z\",\"type\":\"error\",\"payload\":\"Script error.\"},{\"ts\":\"2026-01-02T12:36:43.076Z\",\"type\":\"promise\",\"payload\":\"[object ErrorEvent]\"},{\"ts\":\"2026-01-02T12:36:43.075Z\",\"type\":\"error\",\"payload\":\"Script error.\"},{\"ts\":\"2026-01-02T12:36:43.072Z\",\"type\":\"promise\",\"payload\":\"[object ErrorEvent]\"},{\"ts\":\"2026-01-02T12:36:43.071Z\",\"type\":\"error\",\"payload\":\"Script error.\"},{\"ts\":\"2026-01-02T12:36:43.067Z\",\"type\":\"promise\",\"payload\":\"[object ErrorEvent]\"},{\"ts\":\"2026-01-02T12:36:43.067Z\",\"type\":\"error\",\"payload\":\"Script error.\"},{\"ts\":\"2026-01-02T12:36:43.064Z\",\"type\":\"promise\",\"payload\":\"[object ErrorEvent]\"},{\"ts\":\"2026-01-02T12:36:43.064Z\",\"type\":\"error\",\"payload\":\"Script error.\"},{\"ts\":\"2026-01-02T12:36:43.058Z\",\"type\":\"promise\",\"payload\":\"[object ErrorEvent]\"},{\"ts\":\"2026-01-02T12:36:43.058Z\",\"type\":\"error\",\"payload\":\"Script error.\"},{\"ts\":\"2026-01-02T12:36:43.050Z\",\"type\":\"promise\",\"payload\":\"[object ErrorEvent]\"},{\"ts\":\"2026-01-02T12:36:43.050Z\",\"type\":\"error\",\"payload\":\"Script error.\"},{\"ts\":\"2026-01-02T12:35:22.137Z\",\"type\":\"promise\",\"payload\":\"[object ErrorEvent]\"},{\"ts\":\"2026-01-02T12:35:22.137Z\",\"type\":\"error\",\"payload\":\"Script error.\"},{\"ts\":\"2026-01-02T12:35:22.135Z\",\"type\":\"promise\",\"payload\":\"[object ErrorEvent]\"},{\"ts\":\"2026-01-02T12:35:22.134Z\",\"type\":\"error\",\"payload\":\"Script error.\"},{\"ts\":\"2026-01-02T12:35:22.132Z\",\"type\":\"promise\",\"payload\":\"[object ErrorEvent]\"},{\"ts\":\"2026-01-02T12:35:22.131Z\",\"type\":\"error\",\"payload\":\"Script error.\"},{\"ts\":\"2026-01-02T12:35:22.128Z\",\"type\":\"promise\",\"payload\":\"[object ErrorEvent]\"},{\"ts\":\"2026-01-02T12:35:22.128Z\",\"type\":\"error\",\"payload\":\"Script error.\"},{\"ts\":\"2026-01-02T12:35:22.124Z\",\"type\":\"promise\",\"payload\":\"[object ErrorEvent]\"},{\"ts\":\"2026-01-02T12:35:22.124Z\",\"type\":\"error\",\"payload\":\"Script error.\"},{\"ts\":\"2026-01-02T12:35:22.113Z\",\"type\":\"promise\",\"payload\":\"[object ErrorEvent]\"},{\"ts\":\"2026-01-02T12:35:22.113Z\",\"type\":\"error\",\"payload\":\"Script error.\"},{\"ts\":\"2026-01-02T12:04:30.424Z\",\"type\":\"promise\",\"payload\":\"[object ErrorEvent]\"},{\"ts\":\"2026-01-02T12:04:30.424Z\",\"type\":\"error\",\"payload\":\"Script error.\"},{\"ts\":\"2026-01-02T12:04:30.419Z\",\"type\":\"promise\",\"payload\":\"[object ErrorEvent]\"},{\"ts\":\"2026-01-02T12:04:30.419Z\",\"type\":\"error\",\"payload\":\"Script error.\"},{\"ts\":\"2026-01-02T12:04:30.416Z\",\"type\":\"promise\",\"payload\":\"[object ErrorEvent]\"},{\"ts\":\"2026-01-02T12:04:30.416Z\",\"type\":\"error\",\"payload\":\"Script error.\"},{\"ts\":\"2026-01-02T12:04:30.412Z\",\"type\":\"promise\",\"payload\":\"[object ErrorEvent]\"},{\"ts\":\"2026-01-02T12:04:30.412Z\",\"type\":\"error\",\"payload\":\"Script error.\"},{\"ts\":\"2026-01-02T12:04:30.407Z\",\"type\":\"promise\",\"payload\":\"[object ErrorEvent]\"},{\"ts\":\"2026-01-02T12:04:30.407Z\",\"type\":\"error\",\"payload\":\"Script error.\"},{\"ts\":\"2026-01-02T12:04:30.402Z\",\"type\":\"promise\",\"payload\":\"[object ErrorEvent]\"},{\"ts\":\"2026-01-02T12:04:30.399Z\",\"type\":\"error\",\"payload\":\"Script error.\"},{\"ts\":\"2026-01-02T08:48:08.436Z\",\"type\":\"promise\",\"payload\":\"[object ErrorEvent]\"},{\"ts\":\"2026-01-02T08:48:08.436Z\",\"type\":\"error\",\"payload\":\"Script error.\"},{\"ts\":\"2026-01-02T08:48:08.431Z\",\"type\":\"promise\",\"payload\":\"[object ErrorEvent]\"},{\"ts\":\"2026-01-02T08:48:08.431Z\",\"type\":\"error\",\"payload\":\"Script error.\"},{\"ts\":\"2026-01-02T08:48:08.426Z\",\"type\":\"promise\",\"payload\":\"[object ErrorEvent]\"},{\"ts\":\"2026-01-02T08:48:08.426Z\",\"type\":\"error\",\"payload\":\"Script error.\"},{\"ts\":\"2026-01-02T08:48:08.421Z\",\"type\":\"promise\",\"payload\":\"[object ErrorEvent]\"},{\"ts\":\"2026-01-02T08:48:08.421Z\",\"type\":\"error\",\"payload\":\"Script error.\"},{\"ts\":\"2026-01-02T07:18:06.175Z\",\"type\":\"promise\",\"payload\":\"[object ErrorEvent]\"},{\"ts\":\"2026-01-02T07:18:06.175Z\",\"type\":\"error\",\"payload\":\"Script error.\"},{\"ts\":\"2026-01-02T07:18:06.171Z\",\"type\":\"promise\",\"payload\":\"[object ErrorEvent]\"},{\"ts\":\"2026-01-02T07:18:06.171Z\",\"type\":\"error\",\"payload\":\"Script error.\"},{\"ts\":\"2026-01-02T07:18:06.168Z\",\"type\":\"promise\",\"payload\":\"[object ErrorEvent]\"},{\"ts\":\"2026-01-02T07:18:06.168Z\",\"type\":\"error\",\"payload\":\"Script error.\"},{\"ts\":\"2026-01-02T07:18:06.164Z\",\"type\":\"promise\",\"payload\":\"[object ErrorEvent]\"},{\"ts\":\"2026-01-02T07:18:06.164Z\",\"type\":\"error\",\"payload\":\"Script error.\"},{\"ts\":\"2026-01-02T07:12:08.046Z\",\"type\":\"promise\",\"payload\":\"[object ErrorEvent]\"},{\"ts\":\"2026-01-02T07:12:08.045Z\",\"type\":\"error\",\"payload\":\"Script error.\"},{\"ts\":\"2026-01-02T07:12:08.012Z\",\"type\":\"promise\",\"payload\":\"[object ErrorEvent]\"},{\"ts\":\"2026-01-02T07:12:08.012Z\",\"type\":\"error\",\"payload\":\"Script error.\"},{\"ts\":\"2025-12-31T06:04:51.714Z\",\"type\":\"promise\",\"payload\":\"[object ErrorEvent]\"},{\"ts\":\"2025-12-31T06:04:51.714Z\",\"type\":\"error\",\"payload\":\"Script error.\"},{\"ts\":\"2025-12-31T06:04:51.710Z\",\"type\":\"promise\",\"payload\":\"[object ErrorEvent]\"},{\"ts\":\"2025-12-31T06:04:51.710Z\",\"type\":\"error\",\"payload\":\"Script error.\"},{\"ts\":\"2025-12-31T06:04:51.706Z\",\"type\":\"promise\",\"payload\":\"[object ErrorEvent]\"},{\"ts\":\"2025-12-31T06:04:51.706Z\",\"type\":\"error\",\"payload\":\"Script error.\"},{\"ts\":\"2025-12-31T06:04:51.702Z\",\"type\":\"promise\",\"payload\":\"[object ErrorEvent]\"},{\"ts\":\"2025-12-31T06:04:51.702Z\",\"type\":\"error\",\"payload\":\"Script error.\"},{\"ts\":\"2025-12-31T06:01:58.457Z\",\"type\":\"promise\",\"payload\":\"[object ErrorEvent]\"},{\"ts\":\"2025-12-31T06:01:58.457Z\",\"type\":\"error\",\"payload\":\"Script error.\"},{\"ts\":\"2025-12-31T06:01:58.454Z\",\"type\":\"promise\",\"payload\":\"[object ErrorEvent]\"},{\"ts\":\"2025-12-31T06:01:58.454Z\",\"type\":\"error\",\"payload\":\"Script error.\"},{\"ts\":\"2025-12-31T06:01:58.451Z\",\"type\":\"promise\",\"payload\":\"[object ErrorEvent]\"},{\"ts\":\"2025-12-31T06:01:58.451Z\",\"type\":\"error\",\"payload\":\"Script error.\"},{\"ts\":\"2025-12-31T06:01:58.418Z\",\"type\":\"promise\",\"payload\":\"[object ErrorEvent]\"},{\"ts\":\"2025-12-31T06:01:58.418Z\",\"type\":\"error\",\"payload\":\"Script error.\"},{\"ts\":\"2025-12-30T14:35:04.267Z\",\"type\":\"promise\",\"payload\":\"[object ErrorEvent]\"},{\"ts\":\"2025-12-30T14:35:04.265Z\",\"type\":\"error\",\"payload\":\"Script error.\"},{\"ts\":\"2025-12-30T14:35:04.251Z\",\"type\":\"promise\",\"payload\":\"[object ErrorEvent]\"},{\"ts\":\"2025-12-30T14:35:04.251Z\",\"type\":\"error\",\"payload\":\"Script error.\"},{\"ts\":\"2025-12-30T14:35:04.244Z\",\"type\":\"promise\",\"payload\":\"[object ErrorEvent]\"},{\"ts\":\"2025-12-30T14:35:04.244Z\",\"type\":\"error\",\"payload\":\"Script error.\"},{\"ts\":\"2025-12-30T14:35:04.235Z\",\"type\":\"promise\",\"payload\":\"[object ErrorEvent]\"},{\"ts\":\"2025-12-30T14:35:04.235Z\",\"type\":\"error\",\"payload\":\"Script error.\"},{\"ts\":\"2025-12-30T14:35:04.227Z\",\"type\":\"promise\",\"payload\":\"[object ErrorEvent]\"},{\"ts\":\"2025-12-30T14:35:04.226Z\",\"type\":\"error\",\"payload\":\"Script error.\"},{\"ts\":\"2025-12-30T14:35:04.218Z\",\"type\":\"promise\",\"payload\":\"[object ErrorEvent]\"},{\"ts\":\"2025-12-30T14:35:04.218Z\",\"type\":\"error\",\"payload\":\"Script error.\"},{\"ts\":\"2025-12-30T14:35:04.210Z\",\"type\":\"promise\",\"payload\":\"[object ErrorEvent]\"},{\"ts\":\"2025-12-30T14:35:04.210Z\",\"type\":\"error\",\"payload\":\"Script error.\"},{\"ts\":\"2025-12-30T14:16:02.069Z\",\"type\":\"promise\",\"payload\":\"[object ErrorEvent]\"},{\"ts\":\"2025-12-30T14:16:02.069Z\",\"type\":\"error\",\"payload\":\"Script error.\"},{\"ts\":\"2025-12-30T14:16:02.061Z\",\"type\":\"promise\",\"payload\":\"[object ErrorEvent]\"},{\"ts\":\"2025-12-30T14:16:02.061Z\",\"type\":\"error\",\"payload\":\"Script error.\"},{\"ts\":\"2025-12-30T14:16:02.053Z\",\"type\":\"promise\",\"payload\":\"[object ErrorEvent]\"},{\"ts\":\"2025-12-30T14:16:02.052Z\",\"type\":\"error\",\"payload\":\"Script error.\"},{\"ts\":\"2025-12-30T14:16:02.044Z\",\"type\":\"promise\",\"payload\":\"[object ErrorEvent]\"},{\"ts\":\"2025-12-30T14:16:02.044Z\",\"type\":\"error\",\"payload\":\"Script error.\"},{\"ts\":\"2025-12-30T14:16:02.036Z\",\"type\":\"promise\",\"payload\":\"[object ErrorEvent]\"},{\"ts\":\"2025-12-30T14:16:02.036Z\",\"type\":\"error\",\"payload\":\"Script error.\"},{\"ts\":\"2025-12-30T14:16:02.028Z\",\"type\":\"promise\",\"payload\":\"[object ErrorEvent]\"},{\"ts\":\"2025-12-30T14:16:02.028Z\",\"type\":\"error\",\"payload\":\"Script error.\"},{\"ts\":\"2025-12-30T14:16:02.020Z\",\"type\":\"promise\",\"payload\":\"[object ErrorEvent]\"},{\"ts\":\"2025-12-30T14:16:02.020Z\",\"type\":\"error\",\"payload\":\"Script error.\"},{\"ts\":\"2025-12-30T13:21:18.375Z\",\"type\":\"promise\",\"payload\":\"[object ErrorEvent]\"},{\"ts\":\"2025-12-30T13:21:18.375Z\",\"type\":\"error\",\"payload\":\"Script error.\"}]",
    "auto_backup_2026-01-05": "{\"ts\":\"2026-01-04T21:09:17.162Z\",\"vehicles\":[{\"id\":\"1765890505225\",\"cekiciPlaka\":\"01 AOJ 996\",\"dorsePlaka\":\"33 NA 932\",\"soforAdi\":\"HARUN\",\"soforSoyadi\":\"KUŞCU\",\"iletisim\":\"0533 215 46 63\",\"tcKimlik\":\"10996320044\",\"kantarPersoneli\":\"BUKA\",\"kayitTarihi\":\"16.12.2025 16:08:25\",\"kayitDateKey\":\"2025-12-16\"},{\"id\":\"1766138256845\",\"cekiciPlaka\":\"43 AFG 950\",\"dorsePlaka\":\"43 AFJ 071\",\"soforAdi\":\"ALİ \",\"soforSoyadi\":\"KESKİN\",\"iletisim\":\"0530 849 88 57\",\"tcKimlik\":\"10094763088\",\"kantarPersoneli\":\"BK\",\"kayitTarihi\":\"19.12.2025 12:57:36\",\"kayitDateKey\":\"2025-12-19\"},{\"id\":\"1763376547521\",\"cekiciPlaka\":\"03 ADK 147\",\"dorsePlaka\":\"03 VK 878\",\"soforAdi\":\"HİKMET\",\"soforSoyadi\":\"ERATA\",\"iletisim\":\"0536 604 53 90\",\"tcKimlik\":\"48640529918\",\"kayitTarihi\":\"17.11.2025 13:49:07\",\"kantarPersoneli\":\"Burak Karataş\",\"kayitDateKey\":\"2025-11-17\"},{\"id\":\"1763080013066\",\"cekiciPlaka\":\"43 HP 433\",\"dorsePlaka\":\"34 ZFP 78\",\"soforAdi\":\"ZÜLFÜ\",\"soforSoyadi\":\"USLU\",\"iletisim\":\"0542 508 43 02\",\"tcKimlik\":\"30233102240\",\"kayitTarihi\":\"14.11.2025 03:26:53\",\"kantarPersoneli\":\"Burak Karataş\",\"kayitDateKey\":\"2025-11-14\"},{\"id\":\"1764363806566\",\"cekiciPlaka\":\"35 VNP 36\",\"dorsePlaka\":\"35 AGM 949\",\"soforAdi\":\"FİKRET\",\"soforSoyadi\":\" ERGÖNÜL\",\"iletisim\":\"0532 611 31 43\",\"tcKimlik\":\"15407406614\",\"kantarPersoneli\":\"bk\",\"kayitTarihi\":\"29.11.2025 00:03:26\",\"kayitDateKey\":\"2025-11-29\"},{\"id\":\"1763556459634\",\"cekiciPlaka\":\"01 ALN 562\",\"dorsePlaka\":\"01 ATS 180\",\"soforAdi\":\"SELÇUK\",\"soforSoyadi\":\"ŞAHİN\",\"iletisim\":\"0539 664 02 45\",\"tcKimlik\":\"14548279224\",\"kayitTarihi\":\"19.11.2025 15:47:39\",\"kantarPersoneli\":\"Burak Karataş\",\"kayitDateKey\":\"2025-11-19\"},{\"id\":\"1766130217865\",\"cekiciPlaka\":\"43 AFT 542\",\"dorsePlaka\":\"43 AGY 640\",\"soforAdi\":\"ALİ \",\"soforSoyadi\":\"ZEYBEK\",\"iletisim\":\"0546 286 00 43\",\"tcKimlik\":\"50764406204\",\"kantarPersoneli\":\"\",\"kayitTarihi\":\"19.12.2025 10:43:37\",\"kayitDateKey\":\"2025-12-19\"},{\"id\":\"1764192200252\",\"cekiciPlaka\":\"43 AHC 297\",\"dorsePlaka\":\"43 AHE 944\",\"soforAdi\":\"VEYSEL\",\"soforSoyadi\":\"GÖKÇE\",\"iletisim\":\"0537 660 01 35\",\"tcKimlik\":\"50653409002\",\"kantarPersoneli\":\"BK\",\"kayitTarihi\":\"27.11.2025 00:23:20\",\"kayitDateKey\":\"2025-11-27\"},{\"id\":\"1763077961882\",\"cekiciPlaka\":\"43 ABH 376\",\"dorsePlaka\":\"43 RS 798\",\"soforAdi\":\"MUHSİN\",\"soforSoyadi\":\"TANRIKUL\",\"iletisim\":\"0533 649 77 85\",\"tcKimlik\":\"56164231998\",\"kayitTarihi\":\"14.11.2025 02:52:41\",\"kantarPersoneli\":\"Burak Karataş\",\"kayitDateKey\":\"2025-11-14\"},{\"id\":\"1763076803155\",\"cekiciPlaka\":\"03 AEZ 755\",\"dorsePlaka\":\"20 GA 729\",\"soforAdi\":\"HALİL \",\"soforSoyadi\":\"MERCAN\",\"iletisim\":\"0546 931 34 36\",\"tcKimlik\":\"16153336828\",\"kayitTarihi\":\"14.11.2025 02:33:23\",\"kantarPersoneli\":\"Burak Karataş\",\"kayitDateKey\":\"2025-11-14\"},{\"id\":\"1763715260156\",\"cekiciPlaka\":\"43 AEF 937\",\"dorsePlaka\":\"43 NR 334\",\"soforAdi\":\"HAKKI\",\"soforSoyadi\":\"AKDUMAN\",\"iletisim\":\"0555 022 75 53\",\"tcKimlik\":\"29918107052\",\"kayitTarihi\":\"21.11.2025 11:54:20\",\"kantarPersoneli\":\"Burak Karataş\",\"kayitDateKey\":\"2025-11-21\"},{\"id\":\"1764761727327\",\"cekiciPlaka\":\"43 AK 877\",\"dorsePlaka\":\"43 AAS 563\",\"soforAdi\":\"NEJDET\",\"soforSoyadi\":\"AKCAY\",\"iletisim\":\"0507 779 55 10\",\"tcKimlik\":\"30665081380\",\"kantarPersoneli\":\"BK\",\"kayitTarihi\":\"03.12.2025 14:35:27\",\"kayitDateKey\":\"2025-12-03\"},{\"id\":\"1763077173618\",\"cekiciPlaka\":\"16 AAT 58\",\"dorsePlaka\":\"16 AAJ 58\",\"soforAdi\":\"ÖMER\",\"soforSoyadi\":\"ATAÇ\",\"iletisim\":\"0540 250 16 49\",\"tcKimlik\":\"51763522124\",\"kayitTarihi\":\"14.11.2025 02:39:33\",\"kantarPersoneli\":\"Burak Karataş\",\"kayitDateKey\":\"2025-11-14\"},{\"id\":\"1763155610946\",\"cekiciPlaka\":\"43 ABM 753\",\"dorsePlaka\":\"43 KY 921\",\"soforAdi\":\"MEHMET\",\"soforSoyadi\":\"ÖZTÜRK\",\"iletisim\":\"0541 662 45 46\",\"tcKimlik\":\"58003166278\",\"kayitTarihi\":\"15.11.2025 00:26:50\",\"kantarPersoneli\":\"Burak Karataş\",\"kayitDateKey\":\"2025-11-15\"},{\"id\":\"1763072523243\",\"cekiciPlaka\":\"43 UL 450\",\"dorsePlaka\":\"43 PK 943\",\"soforAdi\":\"TUNAY\",\"soforSoyadi\":\"TEZLİK\",\"iletisim\":\"0544 643 41 52\",\"tcKimlik\":\"21851542198\",\"kayitTarihi\":\"14.11.2025 01:22:03\",\"kantarPersoneli\":\"Burak Karataş\",\"kayitDateKey\":\"2025-11-14\"},{\"id\":\"1763072879738\",\"cekiciPlaka\":\"43 ACJ 711\",\"dorsePlaka\":\"26 YA 490\",\"soforAdi\":\"HASAN HÜSEYİN\",\"soforSoyadi\":\"ERDİREN\",\"iletisim\":\"0546 957 64 28\",\"tcKimlik\":\"13535652224\",\"kayitTarihi\":\"14.11.2025 01:27:59\",\"kantarPersoneli\":\"Burak Karataş\",\"kayitDateKey\":\"2025-11-14\"},{\"id\":\"1763155912288\",\"cekiciPlaka\":\"41 YT 444\",\"dorsePlaka\":\"41 BAE 118\",\"soforAdi\":\"YÜKSEL\",\"soforSoyadi\":\"TURAN\",\"iletisim\":\"0541 234 41 61\",\"tcKimlik\":\"17243823976\",\"kayitTarihi\":\"15.11.2025 00:31:52\",\"kantarPersoneli\":\"Burak Karataş\",\"kayitDateKey\":\"2025-11-15\"},{\"id\":\"1763719337045\",\"cekiciPlaka\":\"64 AG 770\",\"dorsePlaka\":\"64 AG 701\",\"soforAdi\":\"AKIN \",\"soforSoyadi\":\"GÜLER\",\"iletisim\":\"0539 834 56 78\",\"tcKimlik\":\"63013332988\",\"kayitTarihi\":\"21.11.2025 13:02:17\",\"kantarPersoneli\":\"Burak Karataş\",\"kayitDateKey\":\"2025-11-21\"},{\"id\":\"1764192306676\",\"cekiciPlaka\":\"41 KC 400\",\"dorsePlaka\":\"41 EU 067\",\"soforAdi\":\"EMRE\",\"soforSoyadi\":\"UÇAR\",\"iletisim\":\"0532 489 41 67\",\"tcKimlik\":\"61492416700\",\"kantarPersoneli\":\"BK\",\"kayitTarihi\":\"27.11.2025 00:25:06\",\"kayitDateKey\":\"2025-11-27\"},{\"id\":\"1765886250431\",\"cekiciPlaka\":\"43KS292\",\"dorsePlaka\":\"43KS293\",\"soforAdi\":\"KADİR\",\"soforSoyadi\":\"AKKUŞ\",\"iletisim\":\"0532 050 30 43\",\"tcKimlik\":\"18308796920\",\"kantarPersoneli\":\"BUKA\",\"kayitTarihi\":\"16.12.2025 14:57:30\",\"kayitDateKey\":\"2025-12-16\"},{\"id\":\"1763077515523\",\"cekiciPlaka\":\"43 LU 628\",\"dorsePlaka\":\"43 LS 153\",\"soforAdi\":\"MUSTAFA\",\"soforSoyadi\":\"ÖZSAY\",\"iletisim\":\"0543 770 16 62\",\"tcKimlik\":\"49450460866\",\"kayitTarihi\":\"14.11.2025 02:45:15\",\"kantarPersoneli\":\"Burak Karataş\",\"kayitDateKey\":\"2025-11-14\"},{\"id\":\"1763072685362\",\"cekiciPlaka\":\"45 ZC 1272\",\"dorsePlaka\":\"43 AEL 615\",\"soforAdi\":\"YUNUS EMRE\",\"soforSoyadi\":\"TAMAN\",\"iletisim\":\"0541 283 95 19\",\"tcKimlik\":\"47818513018\",\"kayitTarihi\":\"14.11.2025 01:24:45\",\"kantarPersoneli\":\"Burak Karataş\",\"kayitDateKey\":\"2025-11-14\"},{\"id\":\"1764192347651\",\"cekiciPlaka\":\"03 NF 525\",\"dorsePlaka\":\"03 NE 770\",\"soforAdi\":\"HALİL\",\"soforSoyadi\":\"ATA\",\"iletisim\":\"0539 716 20 44\",\"tcKimlik\":\"21928141446\",\"kantarPersoneli\":\"BK\",\"kayitTarihi\":\"27.11.2025 00:25:47\",\"kayitDateKey\":\"2025-11-27\"},{\"id\":\"1763644494973\",\"cekiciPlaka\":\"35 BR 175\",\"dorsePlaka\":\"43 KJ 804\",\"soforAdi\":\"İSMAİL\",\"soforSoyadi\":\"CİNKILINC\",\"iletisim\":\"0546 928 33 70\",\"tcKimlik\":\"60556088570\",\"kayitTarihi\":\"20.11.2025 16:14:54\",\"kantarPersoneli\":\"Burak Karataş\",\"kayitDateKey\":\"2025-11-20\"},{\"id\":\"1765236207425\",\"cekiciPlaka\":\"43 AFE 840\",\"dorsePlaka\":\"43 AGA 981\",\"soforAdi\":\"SÜLEYMAN \",\"soforSoyadi\":\"ULUSOY\",\"iletisim\":\"0535 374 30 17\",\"tcKimlik\":\"34528953234\",\"kantarPersoneli\":\"BK\",\"kayitTarihi\":\"09.12.2025 02:23:27\",\"kayitDateKey\":\"2025-12-09\"},{\"id\":\"1763444993419\",\"cekiciPlaka\":\"01 HK 850\",\"dorsePlaka\":\"01 HK 165\",\"soforAdi\":\"MUSTAFA\",\"soforSoyadi\":\"KEDER\",\"iletisim\":\"0535 245 23 96\",\"tcKimlik\":\"10798437278\",\"kayitTarihi\":\"18.11.2025 08:49:53\",\"kantarPersoneli\":\"Burak Karataş\",\"kayitDateKey\":\"2025-11-18\"},{\"id\":\"1763076249435\",\"cekiciPlaka\":\"43 LT 713\",\"dorsePlaka\":\"43 LT 611\",\"soforAdi\":\"ÖZKAN\",\"soforSoyadi\":\"UÇARKUŞ\",\"iletisim\":\"0551 894 69 10\",\"tcKimlik\":\"72322021728\",\"kayitTarihi\":\"14.11.2025 02:24:09\",\"kantarPersoneli\":\"Burak Karataş\",\"kayitDateKey\":\"2025-11-14\"},{\"id\":\"1763634490245\",\"cekiciPlaka\":\"01 BT 968\",\"dorsePlaka\":\"01 BT 591\",\"soforAdi\":\"HALİL \",\"soforSoyadi\":\"KEDER\",\"iletisim\":\"0544 560 86 96\",\"tcKimlik\":\"40352076018\",\"kayitTarihi\":\"20.11.2025 13:28:10\",\"kantarPersoneli\":\"Burak Karataş\",\"kayitDateKey\":\"2025-11-20\"},{\"id\":\"1765879850058\",\"cekiciPlaka\":\"43RH420\",\"dorsePlaka\":\"43AFU056\",\"soforAdi\":\"ERCAN\",\"soforSoyadi\":\"AVCI\",\"iletisim\":\"0530 580 60 39\",\"tcKimlik\":\"47056529154\",\"kantarPersoneli\":\"BUKA\",\"kayitTarihi\":\"16.12.2025 13:10:50\",\"kayitDateKey\":\"2025-12-16\"},{\"id\":\"1763076327524\",\"cekiciPlaka\":\"01 ET 700\",\"dorsePlaka\":\"01 ET 166\",\"soforAdi\":\"SEZAİ \",\"soforSoyadi\":\"AVCI\",\"iletisim\":\"0541 443 41 39\",\"tcKimlik\":\"12043289635\",\"kayitTarihi\":\"14.11.2025 02:25:27\",\"kantarPersoneli\":\"Burak Karataş\",\"kayitDateKey\":\"2025-11-14\"},{\"id\":\"1763445030907\",\"cekiciPlaka\":\"01 PD 999\",\"dorsePlaka\":\"01 AAU 006\",\"soforAdi\":\"HASAN \",\"soforSoyadi\":\"KURT\",\"iletisim\":\"0543 227 34 63\",\"tcKimlik\":\"57943489188\",\"kayitTarihi\":\"18.11.2025 08:50:30\",\"kantarPersoneli\":\"Burak Karataş\",\"kayitDateKey\":\"2025-11-18\"},{\"id\":\"1766143580972\",\"cekiciPlaka\":\"43 AAB 518\",\"dorsePlaka\":\"42 LR 784\",\"soforAdi\":\"EFRAHİM \",\"soforSoyadi\":\"DEDE\",\"iletisim\":\"0536 452 91 77\",\"tcKimlik\":\"15476581748\",\"kantarPersoneli\":\"BD\",\"kayitTarihi\":\"19.12.2025 14:26:20\",\"kayitDateKey\":\"2025-12-19\"},{\"id\":\"1763075639195\",\"cekiciPlaka\":\"43 EY 222\",\"dorsePlaka\":\"43 AGJ 030\",\"soforAdi\":\"RAMAZAN\",\"soforSoyadi\":\"AYDIN\",\"iletisim\":\"0541 379 97 98\",\"tcKimlik\":\"43879638288\",\"kayitTarihi\":\"14.11.2025 02:13:59\",\"kantarPersoneli\":\"Burak Karataş\",\"kayitDateKey\":\"2025-11-14\"},{\"id\":\"1763155521769\",\"cekiciPlaka\":\"43 ACA 341\",\"dorsePlaka\":\"43 AB 542\",\"soforAdi\":\"RECEP\",\"soforSoyadi\":\"ÖĞÜT\",\"iletisim\":\"0542 786 22 04\",\"tcKimlik\":\"58849142528\",\"kayitTarihi\":\"15.11.2025 00:25:21\",\"kantarPersoneli\":\"Burak Karataş\",\"kayitDateKey\":\"2025-11-15\"},{\"id\":\"1764192399683\",\"cekiciPlaka\":\"43 ABU 203\",\"dorsePlaka\":\"43 ABZ 360\",\"soforAdi\":\"SÜLEYMAN\",\"soforSoyadi\":\"ÖZER\",\"iletisim\":\"0506 052 94 08\",\"tcKimlik\":\"59152138598\",\"kantarPersoneli\":\"BK\",\"kayitTarihi\":\"27.11.2025 00:26:39\",\"kayitDateKey\":\"2025-11-27\"},{\"id\":\"1764290647692\",\"cekiciPlaka\":\"43 AU 420\",\"dorsePlaka\":\"43 BC 420\",\"soforAdi\":\"ÖMER\",\"soforSoyadi\":\"TÜLÜKOÇ\",\"iletisim\":\"0546 598 97 90\",\"tcKimlik\":\"21314387144\",\"kantarPersoneli\":\"BK\",\"kayitTarihi\":\"28.11.2025 03:44:07\",\"kayitDateKey\":\"2025-11-28\"},{\"id\":\"1763078232043\",\"cekiciPlaka\":\"03 AHP 318\",\"dorsePlaka\":\"03 AHP 041\",\"soforAdi\":\"İBRAHİM\",\"soforSoyadi\":\"YANGIÇ\",\"iletisim\":\"0536 615 06 27\",\"tcKimlik\":\"25393058476\",\"kayitTarihi\":\"14.11.2025 02:57:12\",\"kantarPersoneli\":\"Burak Karataş\",\"kayitDateKey\":\"2025-11-14\"},{\"id\":\"1763155394465\",\"cekiciPlaka\":\"03 SK 904\",\"dorsePlaka\":\"03 AIR 777\",\"soforAdi\":\"ERSİN\",\"soforSoyadi\":\"EVRAN\",\"iletisim\":\"0538 830 43 57\",\"tcKimlik\":\"17068304896\",\"kayitTarihi\":\"15.11.2025 00:23:14\",\"kantarPersoneli\":\"Burak Karataş\",\"kayitDateKey\":\"2025-11-15\"},{\"id\":\"1763715930908\",\"cekiciPlaka\":\"03 ADA 252\",\"dorsePlaka\":\"03 ADA 256\",\"soforAdi\":\"AYDIN\",\"soforSoyadi\":\"KİREZ\",\"iletisim\":\"0532 394 73 68\",\"tcKimlik\":\"15808378268\",\"kayitTarihi\":\"21.11.2025 12:05:30\",\"kantarPersoneli\":\"Burak Karataş\",\"kayitDateKey\":\"2025-11-21\"},{\"id\":\"1763077412170\",\"cekiciPlaka\":\"03 AFB 814\",\"dorsePlaka\":\"06 DDE 379\",\"soforAdi\":\"RAMAZAN\",\"soforSoyadi\":\"ARIK\",\"iletisim\":\"0545 420 01 76\",\"tcKimlik\":\"12487488608\",\"kayitTarihi\":\"14.11.2025 02:43:32\",\"kantarPersoneli\":\"Burak Karataş\",\"kayitDateKey\":\"2025-11-14\"},{\"id\":\"1763155643296\",\"cekiciPlaka\":\"43 NU 471\",\"dorsePlaka\":\"43 NU 472\",\"soforAdi\":\"ŞAHİN\",\"soforSoyadi\":\"UZUN\",\"iletisim\":\"0533 816 29 95\",\"tcKimlik\":\"15128598964\",\"kayitTarihi\":\"15.11.2025 00:27:23\",\"kantarPersoneli\":\"Burak Karataş\",\"kayitDateKey\":\"2025-11-15\"},{\"id\":\"1763075262762\",\"cekiciPlaka\":\"43 AHB 272\",\"dorsePlaka\":\"43 ACP 878\",\"soforAdi\":\"BÜNYAMİN\",\"soforSoyadi\":\"GAVAŞ\",\"iletisim\":\"0555 195 57 52\",\"tcKimlik\":\"26513331868\",\"kayitTarihi\":\"14.11.2025 02:07:42\",\"kantarPersoneli\":\"Burak Karataş\",\"kayitDateKey\":\"2025-11-14\"},{\"id\":\"1763704162805\",\"cekiciPlaka\":\"43 AFL 040\",\"dorsePlaka\":\"43 NR 525\",\"soforAdi\":\"İSMAİL\",\"soforSoyadi\":\"ERSÖZ\",\"iletisim\":\"0530 326 29 98\",\"tcKimlik\":\"47812504562\",\"kayitTarihi\":\"21.11.2025 08:49:22\",\"kantarPersoneli\":\"Burak Karataş\",\"kayitDateKey\":\"2025-11-21\"},{\"id\":\"1763077913842\",\"cekiciPlaka\":\"43 ACS 291\",\"dorsePlaka\":\"43 US 868\",\"soforAdi\":\"ADNAN\",\"soforSoyadi\":\"GÖK\",\"iletisim\":\"0542 809 09 53\",\"tcKimlik\":\"47362518736\",\"kayitTarihi\":\"14.11.2025 02:51:53\",\"kantarPersoneli\":\"Burak Karataş\",\"kayitDateKey\":\"2025-11-14\"},{\"id\":\"1764211648953\",\"cekiciPlaka\":\"43 ABV 922\",\"dorsePlaka\":\"43 ACE 205\",\"soforAdi\":\"AHMET\",\"soforSoyadi\":\"KOCAMAN\",\"iletisim\":\"0541 811 55 81\",\"tcKimlik\":\"48280488170\",\"kantarPersoneli\":\"BK\",\"kayitTarihi\":\"27.11.2025 05:47:28\",\"kayitDateKey\":\"2025-11-27\"},{\"id\":\"1763703974654\",\"cekiciPlaka\":\"03 AIP 965\",\"dorsePlaka\":\"03 AIR 043\",\"soforAdi\":\"MUSTAFA\",\"soforSoyadi\":\"KARINCA\",\"iletisim\":\"0541 283 15 74\",\"tcKimlik\":\"16978338960\",\"kayitTarihi\":\"21.11.2025 08:46:14\",\"kantarPersoneli\":\"Burak Karataş\",\"kayitDateKey\":\"2025-11-21\"},{\"id\":\"1763077782667\",\"cekiciPlaka\":\"03 NG 501\",\"dorsePlaka\":\"20 YN 332\",\"soforAdi\":\"ÖNDER\",\"soforSoyadi\":\"ÇETİN\",\"iletisim\":\"0541 508 80 87\",\"tcKimlik\":\"16966293462\",\"kayitTarihi\":\"14.11.2025 02:49:42\",\"kantarPersoneli\":\"Burak Karataş\",\"kayitDateKey\":\"2025-11-14\"},{\"id\":\"1763080953457\",\"cekiciPlaka\":\"03 FY 728\",\"dorsePlaka\":\"03 FL 569\",\"soforAdi\":\"MUHAMMET\",\"soforSoyadi\":\"DEMİRÖZ\",\"iletisim\":\"0532 589 27 24\",\"tcKimlik\":\"16228333806\",\"kayitTarihi\":\"14.11.2025 03:42:33\",\"kantarPersoneli\":\"Burak Karataş\",\"kayitDateKey\":\"2025-11-14\"},{\"id\":\"1763077216738\",\"cekiciPlaka\":\"16 ABJ 49\",\"dorsePlaka\":\"16 KOH 49\",\"soforAdi\":\"ÜMİT\",\"soforSoyadi\":\"YEL\",\"iletisim\":\"0530 054 17 49\",\"tcKimlik\":\"52912481552\",\"kayitTarihi\":\"14.11.2025 02:40:16\",\"kantarPersoneli\":\"Burak Karataş\",\"kayitDateKey\":\"2025-11-14\"},{\"id\":\"1764107921577\",\"cekiciPlaka\":\"41 BN 200\",\"dorsePlaka\":\"41 AJH 579\",\"soforAdi\":\"YUSUF\",\"soforSoyadi\":\"KÜÇÜK\",\"iletisim\":\"0533 434 17 47\",\"tcKimlik\":\"72385121830\",\"kantarPersoneli\":\"BK\",\"kayitTarihi\":\"26.11.2025 00:58:41\",\"kayitDateKey\":\"2025-11-26\"},{\"id\":\"1763077342699\",\"cekiciPlaka\":\"43 ADG 390\",\"dorsePlaka\":\"43 ADG 528\",\"soforAdi\":\"MURAT\",\"soforSoyadi\":\"ÜSTÜNEL\",\"iletisim\":\"0541 464 45 80\",\"tcKimlik\":\"14738608322\",\"kayitTarihi\":\"14.11.2025 02:42:22\",\"kantarPersoneli\":\"Burak Karataş\",\"kayitDateKey\":\"2025-11-14\"},{\"id\":\"1766148573123\",\"cekiciPlaka\":\"06 FNA 782\",\"dorsePlaka\":\"06 CYZ 588\",\"soforAdi\":\"CUMALİ \",\"soforSoyadi\":\"GEZER\",\"iletisim\":\"0541 474 08 68\",\"tcKimlik\":\"69373159272\",\"kantarPersoneli\":\"BK\",\"kayitTarihi\":\"19.12.2025 15:49:33\",\"kayitDateKey\":\"2025-12-19\"},{\"id\":\"1763633113591\",\"cekiciPlaka\":\"64 BE 087\",\"dorsePlaka\":\"64 DE 087\",\"soforAdi\":\"ERDEM\",\"soforSoyadi\":\"COLAK\",\"iletisim\":\"0545 307 96 10\",\"tcKimlik\":\"41926703248\",\"kayitTarihi\":\"20.11.2025 13:05:13\",\"kantarPersoneli\":\"Burak Karataş\",\"kayitDateKey\":\"2025-11-20\"},{\"id\":\"1763073069569\",\"cekiciPlaka\":\"43 RR 303\",\"dorsePlaka\":\"43 BK 243\",\"soforAdi\":\"TAYYİP \",\"soforSoyadi\":\"DAŞÇIGİL\",\"iletisim\":\"0542 612 50 09\",\"tcKimlik\":\"21014403892\",\"kayitTarihi\":\"14.11.2025 01:31:09\",\"kantarPersoneli\":\"Burak Karataş\",\"kayitDateKey\":\"2025-11-14\"},{\"id\":\"1763155436234\",\"cekiciPlaka\":\"43 AES 717\",\"dorsePlaka\":\"43 AGP 975\",\"soforAdi\":\"FATİH\",\"soforSoyadi\":\"KAHRAMAN\",\"iletisim\":\"0544 533 42 43\",\"tcKimlik\":\"58999137450\",\"kayitTarihi\":\"15.11.2025 00:23:56\",\"kantarPersoneli\":\"Burak Karataş\",\"kayitDateKey\":\"2025-11-15\"},{\"id\":\"1763703833366\",\"cekiciPlaka\":\"36 ABD 093\",\"dorsePlaka\":\"43 ABL 484\",\"soforAdi\":\"NUSRET\",\"soforSoyadi\":\"YANIK\",\"iletisim\":\"0545 562 22 45\",\"tcKimlik\":\"32696007698\",\"kayitTarihi\":\"21.11.2025 08:43:53\",\"kantarPersoneli\":\"Burak Karataş\",\"kayitDateKey\":\"2025-11-21\"},{\"id\":\"1763356819840\",\"cekiciPlaka\":\"43 ADL 163\",\"dorsePlaka\":\"43 UT 191\",\"soforAdi\":\"ÖMER\",\"soforSoyadi\":\"KAYGISIZ\",\"iletisim\":\"0545 205 85 06\",\"tcKimlik\":\"15467488668\",\"kayitTarihi\":\"17.11.2025 08:20:19\",\"kantarPersoneli\":\"Burak Karataş\",\"kayitDateKey\":\"2025-11-17\"},{\"id\":\"1763079837689\",\"cekiciPlaka\":\"43 AGV 864\",\"dorsePlaka\":\"43 AFU 046\",\"soforAdi\":\"MEHMET\",\"soforSoyadi\":\"TUTUK\",\"iletisim\":\"0507 567 21 44\",\"tcKimlik\":\"47350524924\",\"kayitTarihi\":\"14.11.2025 03:23:57\",\"kantarPersoneli\":\"Burak Karataş\",\"kayitDateKey\":\"2025-11-14\"},{\"id\":\"1763080067466\",\"cekiciPlaka\":\"43 AGZ 771\",\"dorsePlaka\":\"43 ABY 368\",\"soforAdi\":\"İBRAHİM\",\"soforSoyadi\":\"TEKİN\",\"iletisim\":\"0543 976 97 60\",\"tcKimlik\":\"50425429078\",\"kayitTarihi\":\"14.11.2025 03:27:47\",\"kantarPersoneli\":\"Burak Karataş\",\"kayitDateKey\":\"2025-11-14\"},{\"id\":\"1764277025543\",\"cekiciPlaka\":\"06 FAY 148\",\"dorsePlaka\":\"06 EU 1942\",\"soforAdi\":\"FAHRETTİN\",\"soforSoyadi\":\"YALÇIN\",\"iletisim\":\"0535 580 87 05\",\"tcKimlik\":\"10554202788\",\"kantarPersoneli\":\"BK\",\"kayitTarihi\":\"27.11.2025 23:57:05\",\"kayitDateKey\":\"2025-11-27\"},{\"id\":\"1766131858102\",\"cekiciPlaka\":\"06 DVD 279\",\"dorsePlaka\":\"06 DRH 239\",\"soforAdi\":\"RECEP \",\"soforSoyadi\":\"YILDIRIM\",\"iletisim\":\"0532 137 60 27\",\"tcKimlik\":\"13735004946\",\"kantarPersoneli\":\"\",\"kayitTarihi\":\"19.12.2025 11:10:58\",\"kayitDateKey\":\"2025-12-19\"},{\"id\":\"1763445074899\",\"cekiciPlaka\":\"68 ABN 630\",\"dorsePlaka\":\"68 ADP 925 \",\"soforAdi\":\"CELAL\",\"soforSoyadi\":\"ALTAN\",\"iletisim\":\"0546 787 66 10\",\"tcKimlik\":\"52783709304\",\"kayitTarihi\":\"18.11.2025 08:51:14\",\"kantarPersoneli\":\"Burak Karataş\",\"kayitDateKey\":\"2025-11-18\"},{\"id\":\"1763073024969\",\"cekiciPlaka\":\"43 NZ 152\",\"dorsePlaka\":\"43 ABR 129\",\"soforAdi\":\"MESUT\",\"soforSoyadi\":\"YILDIZ\",\"iletisim\":\"0552 846 01 52\",\"tcKimlik\":\"13061665828\",\"kayitTarihi\":\"14.11.2025 01:30:24\",\"kantarPersoneli\":\"Burak Karataş\",\"kayitDateKey\":\"2025-11-14\"},{\"id\":\"1763076489851\",\"cekiciPlaka\":\"41 AKC 259\",\"dorsePlaka\":\"41 ARF 318\",\"soforAdi\":\"SAMET\",\"soforSoyadi\":\"ŞENGÜL\",\"iletisim\":\"0544 868 42 46\",\"tcKimlik\":\"54910221970\",\"kayitTarihi\":\"14.11.2025 02:28:09\",\"kantarPersoneli\":\"Burak Karataş\",\"kayitDateKey\":\"2025-11-14\"},{\"id\":\"1763369922420\",\"cekiciPlaka\":\"43 AHY 174\",\"dorsePlaka\":\"43 AGY 063\",\"soforAdi\":\"ALİ OSMAN\",\"soforSoyadi\":\"ÖZKARAŞIN\",\"iletisim\":\"0530 546 02 84\",\"tcKimlik\":\"51856375460\",\"kayitTarihi\":\"17.11.2025 11:58:42\",\"kantarPersoneli\":\"Burak Karataş\",\"kayitDateKey\":\"2025-11-17\"},{\"id\":\"1763356785016\",\"cekiciPlaka\":\"15 EE 420\",\"dorsePlaka\":\"43 NY 580\",\"soforAdi\":\"HİDAYET\",\"soforSoyadi\":\"KULA\",\"iletisim\":\"0544 274 43 42\",\"tcKimlik\":\"27641181752\",\"kayitTarihi\":\"17.11.2025 08:19:45\",\"kantarPersoneli\":\"Burak Karataş\",\"kayitDateKey\":\"2025-11-17\"},{\"id\":\"1764290602476\",\"cekiciPlaka\":\"06 ERD 408\",\"dorsePlaka\":\"53 K 2451\",\"soforAdi\":\"ERGÜN\",\"soforSoyadi\":\"GÖRDÜ\",\"iletisim\":\"0542 349 20 53\",\"tcKimlik\":\"12064176850\",\"kantarPersoneli\":\"BK\",\"kayitTarihi\":\"28.11.2025 03:43:22\",\"kayitDateKey\":\"2025-11-28\"},{\"id\":\"1763080675658\",\"cekiciPlaka\":\"03 ADN 645\",\"dorsePlaka\":\"03 AFT 020\",\"soforAdi\":\"GÖKSAL\",\"soforSoyadi\":\"ÖZÇELİK\",\"iletisim\":\"0553 724 95 96\",\"tcKimlik\":\"12001473738\",\"kayitTarihi\":\"14.11.2025 03:37:55\",\"kantarPersoneli\":\"Burak Karataş\",\"kayitDateKey\":\"2025-11-14\"},{\"id\":\"1764281660872\",\"cekiciPlaka\":\"64 AG 670\",\"dorsePlaka\":\"64 AG 705\",\"soforAdi\":\"ANIL\",\"soforSoyadi\":\"GÜLER\",\"iletisim\":\"0541 905 00 64\",\"tcKimlik\":\"62932335698\",\"kantarPersoneli\":\"BK\",\"kayitTarihi\":\"28.11.2025 01:14:20\",\"kayitDateKey\":\"2025-11-28\"},{\"id\":\"1763072987658\",\"cekiciPlaka\":\"43 AHP 979\",\"dorsePlaka\":\"33 E 7300\",\"soforAdi\":\"OKAN\",\"soforSoyadi\":\"DEMİRLİK\",\"iletisim\":\"0530 678 43 15\",\"tcKimlik\":\"47845502870\",\"kayitTarihi\":\"14.11.2025 01:29:47\",\"kantarPersoneli\":\"Burak Karataş\",\"kayitDateKey\":\"2025-11-14\"},{\"id\":\"1763076737202\",\"cekiciPlaka\":\"03 AEM 652\",\"dorsePlaka\":\"03 F 1390\",\"soforAdi\":\"MEHMET ALİ\",\"soforSoyadi\":\"UZUN\",\"iletisim\":\"0534 962 36 32\",\"tcKimlik\":\"46480871716\",\"kayitTarihi\":\"14.11.2025 02:32:17\",\"kantarPersoneli\":\"Burak Karataş\",\"kayitDateKey\":\"2025-11-14\"},{\"id\":\"1764192258467\",\"cekiciPlaka\":\"43 FU 360\",\"dorsePlaka\":\"43 ADD 630\",\"soforAdi\":\"NURULLAH\",\"soforSoyadi\":\"BAYIR\",\"iletisim\":\"0533 603 35 50\",\"tcKimlik\":\"40072768576\",\"kantarPersoneli\":\"BK\",\"kayitTarihi\":\"27.11.2025 00:24:18\",\"kayitDateKey\":\"2025-11-27\"},{\"id\":\"1763072732089\",\"cekiciPlaka\":\"03 AGK 549\",\"dorsePlaka\":\"03 AHG 114\",\"soforAdi\":\"KUDRET\",\"soforSoyadi\":\"EVRAN\",\"iletisim\":\"0505 446 99 03\",\"tcKimlik\":\"10162537498\",\"kayitTarihi\":\"14.11.2025 01:25:32\",\"kantarPersoneli\":\"Burak Karataş\",\"kayitDateKey\":\"2025-11-14\"},{\"id\":\"1763356516001\",\"cekiciPlaka\":\"64 FK 333\",\"dorsePlaka\":\"64 FK 314\",\"soforAdi\":\"HAMİT\",\"soforSoyadi\":\"ÖZDEMİR\",\"iletisim\":\"0555 066 09 54\",\"tcKimlik\":\"18971799472\",\"kayitTarihi\":\"17.11.2025 08:15:16\",\"kantarPersoneli\":\"Burak Karataş\",\"kayitDateKey\":\"2025-11-17\"},{\"id\":\"1763077026076\",\"cekiciPlaka\":\"43 AFL 885 \",\"dorsePlaka\":\"43 AAP 920 \",\"soforAdi\":\"KADERİM\",\"soforSoyadi\":\"EŞSİZ\",\"iletisim\":\"0553 674 71 68\",\"tcKimlik\":\"44152626640\",\"kantarPersoneli\":\"Burak Karataş\",\"kayitTarihi\":\"14.11.2025 02:37:06\",\"kayitDateKey\":\"2025-11-14\"},{\"id\":\"1764192439939\",\"cekiciPlaka\":\"41 AJK 948\",\"dorsePlaka\":\"41 ATN 012\",\"soforAdi\":\"EROL\",\"soforSoyadi\":\"KARADENİZ\",\"iletisim\":\"0532 765 30 49\",\"tcKimlik\":\"27437484234\",\"kantarPersoneli\":\"BK\",\"kayitTarihi\":\"27.11.2025 00:27:19\",\"kayitDateKey\":\"2025-11-27\"},{\"id\":\"1763076925811\",\"cekiciPlaka\":\"43 LR 468\",\"dorsePlaka\":\"43 LR 460\",\"soforAdi\":\"ALİ\",\"soforSoyadi\":\"CAMBEL\",\"iletisim\":\"0535 644 81 83\",\"tcKimlik\":\"33163995616\",\"kayitTarihi\":\"14.11.2025 02:35:25\",\"kantarPersoneli\":\"Burak Karataş\",\"kayitDateKey\":\"2025-11-14\"},{\"id\":\"1763475634332\",\"cekiciPlaka\":\"06 FMT 143\",\"dorsePlaka\":\"06 CIP 276\",\"soforAdi\":\"HÜSEYİN\",\"soforSoyadi\":\"ÇELİK\",\"iletisim\":\"0554 832 75 86\",\"tcKimlik\":\"57430157170\",\"kayitTarihi\":\"18.11.2025 17:20:34\",\"kantarPersoneli\":\"Burak Karataş\",\"kayitDateKey\":\"2025-11-18\"},{\"id\":\"1764278696363\",\"cekiciPlaka\":\"64 ACB 635\",\"dorsePlaka\":\"64 AAG 501\",\"soforAdi\":\"ORHAN\",\"soforSoyadi\":\"ARSLAN\",\"iletisim\":\"0532 418 25 14\",\"tcKimlik\":\"15325449182\",\"kantarPersoneli\":\"BK\",\"kayitTarihi\":\"28.11.2025 00:24:56\",\"kayitDateKey\":\"2025-11-28\"},{\"id\":\"1763078440131\",\"cekiciPlaka\":\"34 SV 0191\",\"dorsePlaka\":\"34 GGA 355\",\"soforAdi\":\"TALİP\",\"soforSoyadi\":\"AKYÜREK\",\"iletisim\":\"0533 132 68 11\",\"tcKimlik\":\"62596173414\",\"kayitTarihi\":\"14.11.2025 03:00:40\",\"kantarPersoneli\":\"Burak Karataş\",\"kayitDateKey\":\"2025-11-14\"},{\"id\":\"1763365951283\",\"cekiciPlaka\":\"34 NKT 233\",\"dorsePlaka\":\"43 PB 087\",\"soforAdi\":\"İLHAMİ\",\"soforSoyadi\":\"DURMAZ\",\"iletisim\":\"0552 945 97 81\",\"tcKimlik\":\"10838736118\",\"kayitTarihi\":\"17.11.2025 10:52:31\",\"kantarPersoneli\":\"Burak Karataş\",\"kayitDateKey\":\"2025-11-17\"},{\"id\":\"1763633156359\",\"cekiciPlaka\":\"01 F 1646\",\"dorsePlaka\":\"01 AHP 869\",\"soforAdi\":\"HALUK\",\"soforSoyadi\":\"ÜNAL\",\"iletisim\":\"0542 788 09 44\",\"tcKimlik\":\"10690365044\",\"kayitTarihi\":\"20.11.2025 13:05:56\",\"kantarPersoneli\":\"Burak Karataş\",\"kayitDateKey\":\"2025-11-20\"},{\"id\":\"1763077465995\",\"cekiciPlaka\":\"43 RV 420\",\"dorsePlaka\":\"43 ACN 153\",\"soforAdi\":\"SÜLEYMAN\",\"soforSoyadi\":\"SERGİN\",\"iletisim\":\"0541 492 56 54\",\"tcKimlik\":\"59818104400\",\"kayitTarihi\":\"14.11.2025 02:44:25\",\"kantarPersoneli\":\"Burak Karataş\",\"kayitDateKey\":\"2025-11-14\"},{\"id\":\"1763155478170\",\"cekiciPlaka\":\"54 ADV 400\",\"dorsePlaka\":\"54 ALF 298\",\"soforAdi\":\"İBRAHİM \",\"soforSoyadi\":\"ÖZTÜRK\",\"iletisim\":\"0536 598 99 30\",\"tcKimlik\":\"39265473526\",\"kayitTarihi\":\"15.11.2025 00:24:38\",\"kantarPersoneli\":\"Burak Karataş\",\"kayitDateKey\":\"2025-11-15\"},{\"id\":\"1763377771983\",\"cekiciPlaka\":\"43 KU 512\",\"dorsePlaka\":\"43 KY 279\",\"soforAdi\":\"RESUL \",\"soforSoyadi\":\"UĞUR\",\"iletisim\":\"0545 884 30 18\",\"tcKimlik\":\"14006640078\",\"kayitTarihi\":\"17.11.2025 14:09:31\",\"kantarPersoneli\":\"Burak Karataş\",\"kayitDateKey\":\"2025-11-17\"},{\"id\":\"1763079660163\",\"cekiciPlaka\":\"03 ADA 017\",\"dorsePlaka\":\"03 ADA 504\",\"soforAdi\":\"BAYRAM \",\"soforSoyadi\":\"DEMİRÖZ\",\"iletisim\":\"0542 546 37 72\",\"tcKimlik\":\"16018340878\",\"kayitTarihi\":\"14.11.2025 03:21:00\",\"kantarPersoneli\":\"Burak Karataş\",\"kayitDateKey\":\"2025-11-14\"},{\"id\":\"1763078789698\",\"cekiciPlaka\":\"43 RU 225\",\"dorsePlaka\":\"43 AAF 514\",\"soforAdi\":\"SÜLEYMAN\",\"soforSoyadi\":\"KOÇ\",\"iletisim\":\"0546 675 35 31\",\"tcKimlik\":\"58738141984\",\"kayitTarihi\":\"14.11.2025 03:06:29\",\"kantarPersoneli\":\"Burak Karataş\",\"kayitDateKey\":\"2025-11-14\"},{\"id\":\"1765865116489\",\"cekiciPlaka\":\"43 U 3603\",\"dorsePlaka\":\"43 YD 378\",\"soforAdi\":\"ERHAN\",\"soforSoyadi\":\"YURDAGÜL\",\"iletisim\":\"0533 331 06 70\",\"tcKimlik\":\"13487325306\",\"kantarPersoneli\":\"BK\",\"kayitTarihi\":\"16.12.2025 09:05:16\",\"kayitDateKey\":\"2025-12-16\"},{\"id\":\"1763077292739\",\"cekiciPlaka\":\"43 AT 808\",\"dorsePlaka\":\"43 DF 333\",\"soforAdi\":\"AHMET\",\"soforSoyadi\":\"OKUMUŞ\",\"iletisim\":\"0554 253 75 17\",\"tcKimlik\":\"37912840486\",\"kayitTarihi\":\"14.11.2025 02:41:32\",\"kantarPersoneli\":\"Burak Karataş\",\"kayitDateKey\":\"2025-11-14\"},{\"id\":\"1763155870129\",\"cekiciPlaka\":\"43 RL 700\",\"dorsePlaka\":\"43 BF 805\",\"soforAdi\":\"İBRAHİM \",\"soforSoyadi\":\"CAN\",\"iletisim\":\"0543 238 30 19\",\"tcKimlik\":\"10856741620\",\"kayitTarihi\":\"15.11.2025 00:31:10\",\"kantarPersoneli\":\"Burak Karataş\",\"kayitDateKey\":\"2025-11-15\"},{\"id\":\"1763075447618\",\"cekiciPlaka\":\"45 ACC 469\",\"dorsePlaka\":\"64 LD 208\",\"soforAdi\":\"YETİŞ\",\"soforSoyadi\":\"EMİR\",\"iletisim\":\"0535 079 42 46\",\"tcKimlik\":\"39527116048\",\"kayitTarihi\":\"14.11.2025 02:10:47\",\"kantarPersoneli\":\"Burak Karataş\",\"kayitDateKey\":\"2025-11-14\"},{\"id\":\"1763077124979\",\"cekiciPlaka\":\"43 KM 240\",\"dorsePlaka\":\"43 ABE 548\",\"soforAdi\":\"İSMAİL\",\"soforSoyadi\":\"KELEŞ\",\"iletisim\":\"0541 182 43 43\",\"tcKimlik\":\"36163895382\",\"kayitTarihi\":\"14.11.2025 02:38:44\",\"kantarPersoneli\":\"Burak Karataş\",\"kayitDateKey\":\"2025-11-14\"},{\"id\":\"1763075581162\",\"cekiciPlaka\":\"61 K 12455\",\"dorsePlaka\":\"41 ANV 762\",\"soforAdi\":\"VOLKAN\",\"soforSoyadi\":\"GEVİNOĞLU\",\"iletisim\":\"0532 391 23 72\",\"tcKimlik\":\"67522187176\",\"kayitTarihi\":\"14.11.2025 02:13:01\",\"kantarPersoneli\":\"Burak Karataş\",\"kayitDateKey\":\"2025-11-14\"},{\"id\":\"1763373810013\",\"cekiciPlaka\":\"42 UE 763\",\"dorsePlaka\":\"67 TM 458\",\"soforAdi\":\"SEDAT\",\"soforSoyadi\":\"AKTAŞ\",\"iletisim\":\"0544 537 04 41\",\"tcKimlik\":\"15127455954\",\"kayitTarihi\":\"17.11.2025 13:03:30\",\"kantarPersoneli\":\"Burak Karataş\",\"kayitDateKey\":\"2025-11-17\"},{\"id\":\"1763076845434\",\"cekiciPlaka\":\"03 AEZ 850\",\"dorsePlaka\":\"03 F 0769\",\"soforAdi\":\"AHMET\",\"soforSoyadi\":\"TANRIVERDİ\",\"iletisim\":\"0535 762 53 47\",\"tcKimlik\":\"12733449384\",\"kayitTarihi\":\"14.11.2025 02:34:05\",\"kantarPersoneli\":\"Burak Karataş\",\"kayitDateKey\":\"2025-11-14\"},{\"id\":\"1763722170352\",\"cekiciPlaka\":\"06 DUB 367\",\"dorsePlaka\":\"06 CVF 668\",\"soforAdi\":\"HASAN\",\"soforSoyadi\":\"SARI\",\"iletisim\":\"5552 217 43 17\",\"tcKimlik\":\"62032404102\",\"kayitTarihi\":\"21.11.2025 13:49:30\",\"kantarPersoneli\":\"Burak Karataş\",\"kayitDateKey\":\"2025-11-21\"},{\"id\":\"1765954581801\",\"cekiciPlaka\":\"43 ACU 874\",\"dorsePlaka\":\"43 AFY 994\",\"soforAdi\":\"Mehmet \",\"soforSoyadi\":\"iyik \",\"iletisim\":\"0535 814 10 44\",\"tcKimlik\":\"53422323240\",\"kantarPersoneli\":\"BUKA\",\"kayitTarihi\":\"17.12.2025 09:56:21\",\"kayitDateKey\":\"2025-12-17\"},{\"id\":\"1763077732179\",\"cekiciPlaka\":\"43 AGF 197\",\"dorsePlaka\":\"43 AGG 734\",\"soforAdi\":\"HİMMET CAN\",\"soforSoyadi\":\"BAYIR\",\"iletisim\":\"0542 585 94 28\",\"tcKimlik\":\"10004765058\",\"kayitTarihi\":\"14.11.2025 02:48:52\",\"kantarPersoneli\":\"Burak Karataş\",\"kayitDateKey\":\"2025-11-14\"},{\"id\":\"1763356613104\",\"cekiciPlaka\":\"43 AFR 264\",\"dorsePlaka\":\"43 ACH 033\",\"soforAdi\":\"MAHMUT\",\"soforSoyadi\":\"SELVİ\",\"iletisim\":\"0532 676 58 76\",\"tcKimlik\":\"20072428342\",\"kayitTarihi\":\"17.11.2025 08:16:53\",\"kantarPersoneli\":\"Burak Karataş\",\"kayitDateKey\":\"2025-11-17\"},{\"id\":\"1763079348707\",\"cekiciPlaka\":\"43 AHH 944\",\"dorsePlaka\":\"43 AHJ 594\",\"soforAdi\":\"HÜSEYİN \",\"soforSoyadi\":\"AŞKIN\",\"iletisim\":\"0533 494 43 89\",\"tcKimlik\":\"23393327608\",\"kayitTarihi\":\"14.11.2025 03:15:48\",\"kantarPersoneli\":\"Burak Karataş\",\"kayitDateKey\":\"2025-11-14\"},{\"id\":\"1763072770442\",\"cekiciPlaka\":\"43 ADA 418\",\"dorsePlaka\":\"43 AAC 365\",\"soforAdi\":\"SÜLEYMAN\",\"soforSoyadi\":\"DALAR\",\"iletisim\":\"0544 845 85 57\",\"tcKimlik\":\"30752072512\",\"kayitTarihi\":\"14.11.2025 01:26:10\",\"kantarPersoneli\":\"Burak Karataş\",\"kayitDateKey\":\"2025-11-14\"},{\"id\":\"1763627936272\",\"cekiciPlaka\":\"43 BB 459\",\"dorsePlaka\":\"43 ABJ 318\",\"soforAdi\":\"RAMAZAN\",\"soforSoyadi\":\"ÜNAL\",\"iletisim\":\"0544 716 01 81\",\"tcKimlik\":\"16364558200\",\"kayitTarihi\":\"20.11.2025 11:38:56\",\"kantarPersoneli\":\"Burak Karataş\",\"kayitDateKey\":\"2025-11-20\"},{\"id\":\"1763356703912\",\"cekiciPlaka\":\"03 VE 062\",\"dorsePlaka\":\"03 VY 062\",\"soforAdi\":\"BURHAN\",\"soforSoyadi\":\"ŞEKER\",\"iletisim\":\"0543 487 89 08\",\"tcKimlik\":\"13360451160\",\"kayitTarihi\":\"17.11.2025 08:18:23\",\"kantarPersoneli\":\"Burak Karataş\",\"kayitDateKey\":\"2025-11-17\"},{\"id\":\"1764761814438\",\"cekiciPlaka\":\"43 DY 102\",\"dorsePlaka\":\"43 RV 301\",\"soforAdi\":\"MEHMET ALİ\",\"soforSoyadi\":\"OK\",\"iletisim\":\"0541 595 42 91\",\"tcKimlik\":\"31988031182\",\"kantarPersoneli\":\"BK\",\"kayitTarihi\":\"03.12.2025 14:36:54\",\"kayitDateKey\":\"2025-12-03\"},{\"id\":\"1765404334261\",\"cekiciPlaka\":\"06 FAY 151\",\"dorsePlaka\":\"06 FAY 564\",\"soforAdi\":\"BAKİ \",\"soforSoyadi\":\"YALÇIN\",\"iletisim\":\"0533 316 48 90\",\"tcKimlik\":\"10945203060\",\"kantarPersoneli\":\"BEKİR\",\"kayitTarihi\":\"11.12.2025 01:05:34\",\"kayitDateKey\":\"2025-12-11\"},{\"id\":\"1763077624348\",\"cekiciPlaka\":\"43 AHK 087\",\"dorsePlaka\":\"43 AHK 363\",\"soforAdi\":\"SELMAN\",\"soforSoyadi\":\"HATİPOĞLU\",\"iletisim\":\"0540 404 43 43\",\"tcKimlik\":\"47488523564\",\"kayitTarihi\":\"14.11.2025 02:47:04\",\"kantarPersoneli\":\"Burak Karataş\",\"kayitDateKey\":\"2025-11-14\"},{\"id\":\"1763380858618\",\"cekiciPlaka\":\"03 F 0750\",\"dorsePlaka\":\"03 AG 012\",\"soforAdi\":\"SÜLEYMAN\",\"soforSoyadi\":\"CENGİZ\",\"iletisim\":\"0544 353 12 97\",\"tcKimlik\":\"19273230366\",\"kayitTarihi\":\"17.11.2025 15:00:58\",\"kantarPersoneli\":\"Burak Karataş\",\"kayitDateKey\":\"2025-11-17\"},{\"id\":\"1763722128681\",\"cekiciPlaka\":\"06 FFB 273\",\"dorsePlaka\":\"06 JVA 59\",\"soforAdi\":\"CEMİL\",\"soforSoyadi\":\"GÖK\",\"iletisim\":\"0554 598 75 76\",\"tcKimlik\":\"16351017802\",\"kayitTarihi\":\"21.11.2025 13:48:48\",\"kantarPersoneli\":\"Burak Karataş\",\"kayitDateKey\":\"2025-11-21\"},{\"id\":\"1763079530723\",\"cekiciPlaka\":\"03 AEZ 751\",\"dorsePlaka\":\"20 GA 729\",\"soforAdi\":\"HALİL \",\"soforSoyadi\":\"MERCAN\",\"iletisim\":\"0546 931 34 36\",\"tcKimlik\":\"16153336828\",\"kayitTarihi\":\"14.11.2025 03:18:50\",\"kantarPersoneli\":\"Burak Karataş\",\"kayitDateKey\":\"2025-11-14\"},{\"id\":\"1763155048415\",\"cekiciPlaka\":\"35 CLN 972\",\"dorsePlaka\":\"43 ACP 084\",\"soforAdi\":\"MEHMET TAHİR\",\"soforSoyadi\":\"GÖKDEMİR\",\"iletisim\":\"0536 035 48 41\",\"tcKimlik\":\"20492125678\",\"kayitTarihi\":\"15.11.2025 00:17:28\",\"kantarPersoneli\":\"Burak Karataş\",\"kayitDateKey\":\"2025-11-15\"},{\"id\":\"1763542093600\",\"cekiciPlaka\":\"06 ESV 266\",\"dorsePlaka\":\"34 LM 2030\",\"soforAdi\":\"AYDIN\",\"soforSoyadi\":\"KILINÇOĞLU\",\"iletisim\":\"0539 786 04 62\",\"tcKimlik\":\"56302105462\",\"kayitTarihi\":\"19.11.2025 11:48:13\",\"kantarPersoneli\":\"Burak Karataş\",\"kayitDateKey\":\"2025-11-19\"},{\"id\":\"1766124403563\",\"cekiciPlaka\":\"36ABD093\",\"dorsePlaka\":\"43ABC484\",\"soforAdi\":\"NUSRET\",\"soforSoyadi\":\"YANIK\",\"iletisim\":\"0535 562 22 45\",\"tcKimlik\":\"32696007698\",\"kantarPersoneli\":\"BEKİR\",\"kayitTarihi\":\"19.12.2025 09:06:43\",\"kayitDateKey\":\"2025-12-19\"},{\"id\":\"1766143201444\",\"cekiciPlaka\":\"43 AFG 955\",\"dorsePlaka\":\"43 AAJ 115\",\"soforAdi\":\"MEHMET \",\"soforSoyadi\":\"TAŞLIK\",\"iletisim\":\"0544 736 83 07\",\"tcKimlik\":\"24451321002\",\"kantarPersoneli\":\"BK\",\"kayitTarihi\":\"19.12.2025 14:20:01\",\"kayitDateKey\":\"2025-12-19\"},{\"id\":\"1763356571280\",\"cekiciPlaka\":\"43 ACV 097\",\"dorsePlaka\":\"43 ADH 808\",\"soforAdi\":\"ZEKİ \",\"soforSoyadi\":\"ERTILMAZ\",\"iletisim\":\"0543 153 43 79\",\"tcKimlik\":\"3242944158\",\"kayitTarihi\":\"17.11.2025 08:16:11\",\"kantarPersoneli\":\"Burak Karataş\",\"kayitDateKey\":\"2025-11-17\"},{\"id\":\"1763370504739\",\"cekiciPlaka\":\"68 HF 687\",\"dorsePlaka\":\"68 ABJ 192\",\"soforAdi\":\"YUSUF\",\"soforSoyadi\":\"ÇETİNKAYA\",\"iletisim\":\"0535 829 77 50\",\"tcKimlik\":\"61459423048\",\"kayitTarihi\":\"17.11.2025 12:08:24\",\"kantarPersoneli\":\"Burak Karataş\",\"kayitDateKey\":\"2025-11-17\"},{\"id\":\"1763374886348\",\"cekiciPlaka\":\"43 AEU 385\",\"dorsePlaka\":\"43 BK 110\",\"soforAdi\":\"MUSA\",\"soforSoyadi\":\"KULUÇ\",\"iletisim\":\"0545 270 06 70\",\"tcKimlik\":\"67885068648\",\"kayitTarihi\":\"17.11.2025 13:21:26\",\"kantarPersoneli\":\"Burak Karataş\",\"kayitDateKey\":\"2025-11-17\"},{\"id\":\"1763080254185\",\"cekiciPlaka\":\"43 AR 769\",\"dorsePlaka\":\"43 FR 421\",\"soforAdi\":\"CEMİL\",\"soforSoyadi\":\"YILDIZ\",\"iletisim\":\"0538 420 62 81\",\"tcKimlik\":\"62098034046\",\"kayitTarihi\":\"14.11.2025 03:30:54\",\"kantarPersoneli\":\"Burak Karataş\",\"kayitDateKey\":\"2025-11-14\"},{\"id\":\"1763078351819\",\"cekiciPlaka\":\"43 AGF 879\",\"dorsePlaka\":\"43 AGU 259\",\"soforAdi\":\"HİDAYET\",\"soforSoyadi\":\"KARAKUŞ\",\"iletisim\":\"0545 583 35 80\",\"tcKimlik\":\"60178103118\",\"kayitTarihi\":\"14.11.2025 02:59:11\",\"kantarPersoneli\":\"Burak Karataş\",\"kayitDateKey\":\"2025-11-14\"},{\"id\":\"1763708056359\",\"cekiciPlaka\":\"43 LT 777\",\"dorsePlaka\":\"43 LT 206\",\"soforAdi\":\"ŞAHİN\",\"soforSoyadi\":\"ÇALIŞKAN\",\"iletisim\":\"0537 496 49 53\",\"tcKimlik\":\"49636446394\",\"kayitTarihi\":\"21.11.2025 09:54:16\",\"kantarPersoneli\":\"Burak Karataş\",\"kayitDateKey\":\"2025-11-21\"},{\"id\":\"1765317265586\",\"cekiciPlaka\":\"41 HC 755\",\"dorsePlaka\":\"41 SK 942\",\"soforAdi\":\"KASIM\",\"soforSoyadi\":\"KANIK\",\"iletisim\":\"0535 618 60 12\",\"tcKimlik\":\"11363674180\",\"kantarPersoneli\":\"BK\",\"kayitTarihi\":\"10.12.2025 00:54:25\",\"kayitDateKey\":\"2025-12-10\"},{\"id\":\"1765404395018\",\"cekiciPlaka\":\"06 DPA 778 \",\"dorsePlaka\":\"06CHL734\",\"soforAdi\":\"FATİH \",\"soforSoyadi\":\"YILDIRIM\",\"iletisim\":\"0538 256 37 65\",\"tcKimlik\":\"17816002236\",\"kantarPersoneli\":\"BEKİR \",\"kayitTarihi\":\"11.12.2025 01:06:35\",\"kayitDateKey\":\"2025-12-11\"},{\"id\":\"1766134212467\",\"cekiciPlaka\":\"35 VRV 29\",\"dorsePlaka\":\"35 AOR 435\",\"soforAdi\":\"ERTUĞRUL\",\"soforSoyadi\":\"ÖZTÜRK\",\"iletisim\":\"0535 389 39 73\",\"tcKimlik\":\"44029136616\",\"kantarPersoneli\":\"BEKİR \",\"kayitTarihi\":\"19.12.2025 11:50:12\",\"kayitDateKey\":\"2025-12-19\"},{\"id\":\"1766138603043\",\"cekiciPlaka\":\"68 AFB 111\",\"dorsePlaka\":\"68 ABS 110\",\"soforAdi\":\"MEHMET \",\"soforSoyadi\":\"YEŞİL\",\"iletisim\":\"0536 710 23 28\",\"tcKimlik\":\"16415921762\",\"kantarPersoneli\":\"BK\",\"kayitTarihi\":\"19.12.2025 13:03:23\",\"kayitDateKey\":\"2025-12-19\"},{\"id\":\"1764761769367\",\"cekiciPlaka\":\"43 FS 500\",\"dorsePlaka\":\"43 AAC 500\",\"soforAdi\":\"SABRİ \",\"soforSoyadi\":\"KURT\",\"iletisim\":\"0536 570 89 19\",\"tcKimlik\":\"15917573042\",\"kantarPersoneli\":\"BK\",\"kayitTarihi\":\"03.12.2025 14:36:09\",\"kayitDateKey\":\"2025-12-03\"},{\"id\":\"1763072942794\",\"cekiciPlaka\":\"43 ADB 640\",\"dorsePlaka\":\"43 DH 489\",\"soforAdi\":\"AHMET\",\"soforSoyadi\":\"SERGİN\",\"iletisim\":\"0530 746 87 68\",\"tcKimlik\":\"59836103836\",\"kayitTarihi\":\"14.11.2025 01:29:02\",\"kantarPersoneli\":\"Burak Karataş\",\"kayitDateKey\":\"2025-11-14\"},{\"id\":\"1763080896473\",\"cekiciPlaka\":\"03 NE 363\",\"dorsePlaka\":\"03 NF 856\",\"soforAdi\":\"MAHİR\",\"soforSoyadi\":\"EVRAN\",\"iletisim\":\"0539 933 20 54\",\"tcKimlik\":\"17149302186\",\"kayitTarihi\":\"14.11.2025 03:41:36\"},{\"id\":\"1763649557172\",\"cekiciPlaka\":\"43 AHB 908\",\"dorsePlaka\":\"43 FR 839\",\"soforAdi\":\"HALİT\",\"soforSoyadi\":\"YAŞAR\",\"iletisim\":\"0542 256 09 43\",\"tcKimlik\":\"32113704506\",\"kayitTarihi\":\"20.11.2025 17:39:17\",\"kantarPersoneli\":\"Burak Karataş\",\"kayitDateKey\":\"2025-11-20\"},{\"id\":\"1763077869722\",\"cekiciPlaka\":\"43 ACT 923\",\"dorsePlaka\":\"43 ACC 220\",\"soforAdi\":\"MURAT\",\"soforSoyadi\":\"GÖK\",\"iletisim\":\"0536 282 53 11\",\"tcKimlik\":\"47398517598\",\"kayitTarihi\":\"14.11.2025 02:51:09\",\"kantarPersoneli\":\"Burak Karataş\",\"kayitDateKey\":\"2025-11-14\"},{\"id\":\"1763361079969\",\"cekiciPlaka\":\"43 AEH 601\",\"dorsePlaka\":\"43 AFE 194\",\"soforAdi\":\"NUH İBRAHİM\",\"soforSoyadi\":\"DURMAZ\",\"iletisim\":\"0507 622 43 05\",\"tcKimlik\":\"10850735762\",\"kayitTarihi\":\"17.11.2025 09:31:19\",\"kantarPersoneli\":\"Burak Karataş\",\"kayitDateKey\":\"2025-11-17\"},{\"id\":\"1763356746808\",\"cekiciPlaka\":\"43 DH 755\",\"dorsePlaka\":\"43 AGZ 589\",\"soforAdi\":\"İSMAİL\",\"soforSoyadi\":\"YAMAN\",\"iletisim\":\"0535 371 54 32\",\"tcKimlik\":\"35821903360\",\"kayitTarihi\":\"17.11.2025 08:19:06\",\"kantarPersoneli\":\"Burak Karataş\",\"kayitDateKey\":\"2025-11-17\"},{\"id\":\"1766131727526\",\"cekiciPlaka\":\"06 DYL 162\",\"dorsePlaka\":\"06 DRH 580\",\"soforAdi\":\"ŞABAN \",\"soforSoyadi\":\"YILDIRIM\",\"iletisim\":\"0531 200 07 23\",\"tcKimlik\":\"13732005090\",\"kantarPersoneli\":\"\",\"kayitTarihi\":\"19.12.2025 11:08:47\",\"kayitDateKey\":\"2025-12-19\"},{\"id\":\"1765888989739\",\"cekiciPlaka\":\"43ADH510\",\"dorsePlaka\":\"43AAV886\",\"soforAdi\":\"KEMAL\",\"soforSoyadi\":\"BAYIR\",\"iletisim\":\"0538 526 76 23\",\"tcKimlik\":\"40027770074\",\"kantarPersoneli\":\"BUKA\",\"kayitTarihi\":\"16.12.2025 15:43:09\",\"kayitDateKey\":\"2025-12-16\"},{\"id\":\"1765865161289\",\"cekiciPlaka\":\"43KM240\",\"dorsePlaka\":\"43ABE548\",\"soforAdi\":\"UĞUR\",\"soforSoyadi\":\"YILDIZ\",\"iletisim\":\"0537 294 72 17\",\"tcKimlik\":\"35143909194\",\"kantarPersoneli\":\"BK\",\"kayitTarihi\":\"16.12.2025 09:06:01\",\"kayitDateKey\":\"2025-12-16\"},{\"id\":\"1763639244661\",\"cekiciPlaka\":\"50 ACL 136\",\"dorsePlaka\":\"16 BUU 201\",\"soforAdi\":\"İSA\",\"soforSoyadi\":\"ERASLAN\",\"iletisim\":\"0531 568 49 51\",\"tcKimlik\":\"39775931318\",\"kayitTarihi\":\"20.11.2025 14:47:24\",\"kantarPersoneli\":\"Burak Karataş\",\"kayitDateKey\":\"2025-11-20\"},{\"id\":\"1763704022702\",\"cekiciPlaka\":\"43 AFG 313\",\"dorsePlaka\":\"43 AAV851\",\"soforAdi\":\"AHMET \",\"soforSoyadi\":\"KASAP\",\"iletisim\":\"0546 579 14 34\",\"tcKimlik\":\"5912212668\",\"kayitTarihi\":\"21.11.2025 08:47:02\",\"kantarPersoneli\":\"Burak Karataş\",\"kayitDateKey\":\"2025-11-21\"},{\"id\":\"1765404501282\",\"cekiciPlaka\":\"43 ACJ 126\",\"dorsePlaka\":\"43 ABG 772\",\"soforAdi\":\"GÜLTEKİN \",\"soforSoyadi\":\"KOCABEY\",\"iletisim\":\"0536 833 67 33\",\"tcKimlik\":\"31292060564\",\"kantarPersoneli\":\"BEKİR \",\"kayitTarihi\":\"11.12.2025 01:08:21\",\"kayitDateKey\":\"2025-12-11\"},{\"id\":\"1764761637808\",\"cekiciPlaka\":\"43 ABR 695\",\"dorsePlaka\":\"43 ABR 689\",\"soforAdi\":\"AHMET\",\"soforSoyadi\":\"ÖZTÜRK\",\"iletisim\":\"0533 337 39 80\",\"tcKimlik\":\"39574785020\",\"kantarPersoneli\":\"BK\",\"kayitTarihi\":\"03.12.2025 14:33:57\",\"kayitDateKey\":\"2025-12-03\"},{\"id\":\"1763356662032\",\"cekiciPlaka\":\"03 AGV 490\",\"dorsePlaka\":\"03 SE 163\",\"soforAdi\":\"BÜLENT\",\"soforSoyadi\":\"ŞEKER\",\"iletisim\":\"0501 324 86 81\",\"tcKimlik\":\"13372450724\",\"kayitTarihi\":\"17.11.2025 08:17:42\",\"kantarPersoneli\":\"Burak Karataş\",\"kayitDateKey\":\"2025-11-17\"},{\"id\":\"1763075502874\",\"cekiciPlaka\":\"35 CLN 059\",\"dorsePlaka\":\"35 CLR 074\",\"soforAdi\":\"HALİL \",\"soforSoyadi\":\"ONUR\",\"iletisim\":\"0534 499 77 44\",\"tcKimlik\":\"11363730206\",\"kayitTarihi\":\"14.11.2025 02:11:42\",\"kantarPersoneli\":\"Burak Karataş\",\"kayitDateKey\":\"2025-11-14\"},{\"id\":\"1763079439178\",\"cekiciPlaka\":\"43 RY 420\",\"dorsePlaka\":\"43 ACN 153\",\"soforAdi\":\"SÜLEYMAN \",\"soforSoyadi\":\"SERGİN\",\"iletisim\":\"0541 492 56 54\",\"tcKimlik\":\"59818104400\",\"kayitTarihi\":\"14.11.2025 03:17:19\",\"kantarPersoneli\":\"Burak Karataş\",\"kayitDateKey\":\"2025-11-14\"},{\"id\":\"1765322030549\",\"cekiciPlaka\":\"15AAV001\",\"dorsePlaka\":\"43ABN611\",\"soforAdi\":\"CEMİL\",\"soforSoyadi\":\"AKDUMAN\",\"iletisim\":\"0541 383 20 56\",\"tcKimlik\":\"37780844708\",\"kantarPersoneli\":\"BK\",\"kayitTarihi\":\"10.12.2025 02:13:50\",\"kayitDateKey\":\"2025-12-10\"},{\"id\":\"1763079208738\",\"cekiciPlaka\":\"43 ACC 240\",\"dorsePlaka\":\"43 AT 816\",\"soforAdi\":\"AHMET\",\"soforSoyadi\":\"ÖZTÜRK\",\"iletisim\":\"0535 375 05 58\",\"tcKimlik\":\"58000166332\",\"kayitTarihi\":\"14.11.2025 03:13:28\",\"kantarPersoneli\":\"Burak Karataş\",\"kayitDateKey\":\"2025-11-14\"},{\"id\":\"1763155089585\",\"cekiciPlaka\":\"43 ACM 276\",\"dorsePlaka\":\"43 RY 54\",\"soforAdi\":\"SELAMİ\",\"soforSoyadi\":\"HÜRATA\",\"iletisim\":\"0534 331 66 81\",\"tcKimlik\":\"48682481236\",\"kayitTarihi\":\"15.11.2025 00:18:09\",\"kantarPersoneli\":\"Burak Karataş\",\"kayitDateKey\":\"2025-11-15\"},{\"id\":\"1763076657779\",\"cekiciPlaka\":\"03 BR 540\",\"dorsePlaka\":\"03 AGD 677\",\"soforAdi\":\"MEHMET\",\"soforSoyadi\":\"BAŞAK\",\"iletisim\":\"0532 463 73 79\",\"tcKimlik\":\"23842126660\",\"kayitTarihi\":\"14.11.2025 02:30:57\",\"kantarPersoneli\":\"Burak Karataş\",\"kayitDateKey\":\"2025-11-14\"},{\"id\":\"1763075004890\",\"cekiciPlaka\":\"41 LH 440\",\"dorsePlaka\":\"41 AVZ 765\",\"soforAdi\":\"EMRE\",\"soforSoyadi\":\"ATAŞ\",\"iletisim\":\"0545 312 92 05\",\"tcKimlik\":\"46663496880\",\"kayitTarihi\":\"14.11.2025 02:03:24\",\"kantarPersoneli\":\"Burak Karataş\",\"kayitDateKey\":\"2025-11-14\"},{\"id\":\"1766315571064\",\"cekiciPlaka\":\"34 ABC 567\",\"dorsePlaka\":\"34 ASV 255\",\"soforAdi\":\"MEHMET\",\"soforSoyadi\":\"YILMAZ\",\"iletisim\":\"0555 123 45 63\",\"tcKimlik\":\"12345678901\",\"kayitTarihi\":\"21.12.2025 14:12:51\"},{\"id\":\"1766351215338\",\"cekiciPlaka\":\"34 GH 9685\",\"dorsePlaka\":\"43 ACM 177\",\"soforAdi\":\"İSMAİL \",\"soforSoyadi\":\"ATICI\",\"iletisim\":\"0551 973 35 07\",\"tcKimlik\":\"11243729818\",\"kayitTarihi\":\"22.12.2025 00:06:55\"},{\"id\":\"1766352144023\",\"cekiciPlaka\":\"34 EEE 404\",\"dorsePlaka\":\"20 AGT 937\",\"soforAdi\":\"ŞENOL \",\"soforSoyadi\":\"ATA\",\"iletisim\":\"0554 662 45 18\",\"tcKimlik\":\"21943140936\",\"kayitTarihi\":\"22.12.2025 00:22:24\"},{\"id\":\"1766359068364\",\"cekiciPlaka\":\"03 AEH 178\",\"dorsePlaka\":\"07 ALE 971\",\"soforAdi\":\"YUSUF \",\"soforSoyadi\":\"ZEYBEK\",\"iletisim\":\"0532 135 68 79\",\"tcKimlik\":\"20923737114\",\"kayitTarihi\":\"22.12.2025 02:17:48\"},{\"id\":\"1766359472724\",\"cekiciPlaka\":\"16 BRM 013\",\"dorsePlaka\":\"54 BR 709\",\"soforAdi\":\"ADNAN \",\"soforSoyadi\":\"SARDOHAN\",\"iletisim\":\"0545 433 60 00\",\"tcKimlik\":\"21295148888\",\"kayitTarihi\":\"22.12.2025 02:24:32\"},{\"id\":\"1766359686962\",\"cekiciPlaka\":\"03 NE 555\",\"dorsePlaka\":\"03 NC 401\",\"soforAdi\":\"İBRAHİM \",\"soforSoyadi\":\"ÇINAR \",\"iletisim\":\"0537 419 16 06\",\"tcKimlik\":\"20902161944\",\"kayitTarihi\":\"22.12.2025 02:28:06\"},{\"id\":\"1766360010627\",\"cekiciPlaka\":\"43 AAS 580\",\"dorsePlaka\":\"54 AHZ 441\",\"soforAdi\":\"KADİR \",\"soforSoyadi\":\"HORATA\",\"iletisim\":\"0534 642 68 81\",\"tcKimlik\":\"49759445366\",\"kayitTarihi\":\"22.12.2025 02:33:30\"},{\"id\":\"1766360394786\",\"cekiciPlaka\":\"43 AHN 241\",\"dorsePlaka\":\"43 ADA 563\",\"soforAdi\":\"MEHMET  \",\"soforSoyadi\":\"İŞCAN\",\"iletisim\":\"0506 366 89 67\",\"tcKimlik\":\"24551285990\",\"kayitTarihi\":\"22.12.2025 02:39:54\"},{\"id\":\"1766362616871\",\"cekiciPlaka\":\"43 ADA 591\",\"dorsePlaka\":\"43 ABK 213\",\"soforAdi\":\"AHMET \",\"soforSoyadi\":\"ACAR\",\"iletisim\":\"0530 774 08 66\",\"tcKimlik\":\"25658249090\",\"kayitTarihi\":\"22.12.2025 03:16:56\"},{\"id\":\"1766362865479\",\"cekiciPlaka\":\"43 HN 842\",\"dorsePlaka\":\"43 AEE 092\",\"soforAdi\":\"MEHMET ALİ\",\"soforSoyadi\":\"İRTEGÜN\",\"iletisim\":\"0536 073 59 04\",\"tcKimlik\":\"58627150172\",\"kayitTarihi\":\"22.12.2025 03:21:05\"},{\"id\":\"1766373399685\",\"cekiciPlaka\":\"42 EGL 81\",\"dorsePlaka\":\"03 AGP 944\",\"soforAdi\":\"ALİ ALPER \",\"soforSoyadi\":\"YAĞDIRABN\",\"iletisim\":\"0545 391 71 30\",\"tcKimlik\":\"24595099744\",\"kayitTarihi\":\"22.12.2025 06:16:39\"},{\"id\":\"1766437756212\",\"cekiciPlaka\":\"64 ADV 494\",\"dorsePlaka\":\"64 AJ 692\",\"soforAdi\":\"RAMAZAN \",\"soforSoyadi\":\"AKGÜN\",\"iletisim\":\"0543 582 43 64\",\"tcKimlik\":\"33838973116\",\"kayitTarihi\":\"23.12.2025 00:09:16\"},{\"id\":\"1766461585041\",\"cekiciPlaka\":\"35 BGL 547 \",\"dorsePlaka\":\"35 AFJ 355\",\"soforAdi\":\"KAZIM \",\"soforSoyadi\":\"EMİROĞLU\",\"iletisim\":\"0531 562 20 46\",\"tcKimlik\":\"11773416134\",\"kayitTarihi\":\"23.12.2025 06:46:25\"},{\"id\":\"1766610311426\",\"cekiciPlaka\":\"43 SR 441\",\"dorsePlaka\":\"43 SR 431\",\"soforAdi\":\"İBRAHİM \",\"soforSoyadi\":\"ÖZKOÇLAR \",\"iletisim\":\"0507 812 08 09\",\"tcKimlik\":\"44422623232\",\"defaultFirma\":\"\",\"defaultMalzeme\":\"\",\"defaultSevkYeri\":\"\",\"defaultYuklemeNotu\":\"\",\"kayitTarihi\":\"25.12.2025 00:05:11\"},{\"id\":\"1766610561258\",\"cekiciPlaka\":\"43 AHN 384\",\"dorsePlaka\":\"43 AFT 897\",\"soforAdi\":\"HÜSEYİN \",\"soforSoyadi\":\"ÖZSANKUR \",\"iletisim\":\"0553 379 09 50\",\"tcKimlik\":\"50002437236\",\"defaultFirma\":\"\",\"defaultMalzeme\":\"\",\"defaultSevkYeri\":\"\",\"defaultYuklemeNotu\":\"\",\"kayitTarihi\":\"25.12.2025 00:09:21\"},{\"id\":\"1766611017938\",\"cekiciPlaka\":\"43 AFR 607\",\"dorsePlaka\":\"43 AFT 055\",\"soforAdi\":\"ÖZGÜR\",\"soforSoyadi\":\"ÖZEMİRDAĞ\",\"iletisim\":\"0539 272 83 13\",\"tcKimlik\":\"18605483432\",\"defaultFirma\":\"\",\"defaultMalzeme\":\"\",\"defaultSevkYeri\":\"\",\"defaultYuklemeNotu\":\"\",\"kayitTarihi\":\"25.12.2025 00:16:57\"},{\"id\":\"1766611288697\",\"cekiciPlaka\":\"43 ADN 609\",\"dorsePlaka\":\"43 AEP 674\",\"soforAdi\":\"İSMAİL \",\"soforSoyadi\":\"ÖZİRKİN\",\"iletisim\":\"0546 275 20 93\",\"tcKimlik\":\"49114466814\",\"defaultFirma\":\"\",\"defaultMalzeme\":\"\",\"defaultSevkYeri\":\"\",\"defaultYuklemeNotu\":\"\",\"kayitTarihi\":\"25.12.2025 00:21:28\"},{\"id\":\"1766611791160\",\"cekiciPlaka\":\"03 FU 100\",\"dorsePlaka\":\"03 FY 818\",\"soforAdi\":\"ABBAS \",\"soforSoyadi\":\"DEMİRÖZ \",\"iletisim\":\"0532 441 63 17\",\"tcKimlik\":\"16270332420\",\"defaultFirma\":\"\",\"defaultMalzeme\":\"\",\"defaultSevkYeri\":\"\",\"defaultYuklemeNotu\":\"\",\"kayitTarihi\":\"25.12.2025 00:29:51\"},{\"id\":\"1766612089472\",\"cekiciPlaka\":\"41 AUY 145\",\"dorsePlaka\":\"41 BAZ 853\",\"soforAdi\":\"ERTAN \",\"soforSoyadi\":\"YAVUZ \",\"iletisim\":\"0540 621 41 61\",\"tcKimlik\":\"61843327600\",\"defaultFirma\":\"\",\"defaultMalzeme\":\"\",\"defaultSevkYeri\":\"\",\"defaultYuklemeNotu\":\"\",\"kayitTarihi\":\"25.12.2025 00:34:49\"},{\"id\":\"1766612733208\",\"cekiciPlaka\":\"03 BS 560\",\"dorsePlaka\":\"03 BS 561\",\"soforAdi\":\"CAFER \",\"soforSoyadi\":\"DEMİRÖZ\",\"iletisim\":\"0532 573 15 05\",\"tcKimlik\":\"16141336724\",\"defaultFirma\":\"\",\"defaultMalzeme\":\"\",\"defaultSevkYeri\":\"\",\"defaultYuklemeNotu\":\"\",\"kayitTarihi\":\"25.12.2025 00:45:33\"},{\"id\":\"1766612982063\",\"cekiciPlaka\":\"06 EY 6695\",\"dorsePlaka\":\"06 EU 1942\",\"soforAdi\":\"BAKİ \",\"soforSoyadi\":\"YALÇIN\",\"iletisim\":\"0533 316 48 90\",\"tcKimlik\":\"10945203060\",\"defaultFirma\":\"\",\"defaultMalzeme\":\"\",\"defaultSevkYeri\":\"\",\"defaultYuklemeNotu\":\"\",\"kayitTarihi\":\"25.12.2025 00:49:42\"},{\"id\":\"1766696860840\",\"cekiciPlaka\":\"03 AHK 418\",\"dorsePlaka\":\"03 AFT 492\",\"soforAdi\":\"AHMET \",\"soforSoyadi\":\"BALCI\",\"iletisim\":\"0537 347 50 30\",\"tcKimlik\":\"11452523092\",\"defaultFirma\":\"\",\"defaultMalzeme\":\"\",\"defaultSevkYeri\":\"\",\"defaultYuklemeNotu\":\"\",\"kayitTarihi\":\"26.12.2025 00:07:40\"},{\"id\":\"1766697076528\",\"cekiciPlaka\":\"01 BT 790\",\"dorsePlaka\":\"01 BT 422\",\"soforAdi\":\"MİKAİL \",\"soforSoyadi\":\"TOKMAK \",\"iletisim\":\"0530 068 52 43\",\"tcKimlik\":\"22147363862\",\"defaultFirma\":\"\",\"defaultMalzeme\":\"\",\"defaultSevkYeri\":\"\",\"defaultYuklemeNotu\":\"\",\"kayitTarihi\":\"26.12.2025 00:11:16\"},{\"id\":\"1766712379775\",\"cekiciPlaka\":\"15 AAV 001\",\"dorsePlaka\":\"43 ABN 611\",\"soforAdi\":\"CEMİL \",\"soforSoyadi\":\"AKDUMAN \",\"iletisim\":\"0541 383 20 56\",\"tcKimlik\":\"37780844708\",\"defaultFirma\":\"\",\"defaultMalzeme\":\"\",\"defaultSevkYeri\":\"\",\"defaultYuklemeNotu\":\"\",\"kayitTarihi\":\"26.12.2025 04:26:19\"},{\"id\":\"1766787274779\",\"cekiciPlaka\":\"06FAY148\",\"dorsePlaka\":\"06 FOF 241\",\"soforAdi\":\"APDURRAHMAN \",\"soforSoyadi\":\"YALÇIN\",\"iletisim\":\"0553 200 67 97\",\"tcKimlik\":\"10009234818\",\"defaultFirma\":\"\",\"defaultMalzeme\":\"\",\"defaultSevkYeri\":\"\",\"defaultYuklemeNotu\":\"\",\"kayitTarihi\":\"27.12.2025 01:14:34\"},{\"id\":\"1766787607395\",\"cekiciPlaka\":\"06EY 6695\",\"dorsePlaka\":\"06 EU 1942\",\"soforAdi\":\"FEVZİ\",\"soforSoyadi\":\"YALÇIN\",\"iletisim\":\"0532 460 46 00\",\"tcKimlik\":\"10813207428\",\"defaultFirma\":\"\",\"defaultMalzeme\":\"\",\"defaultSevkYeri\":\"\",\"defaultYuklemeNotu\":\"\",\"kayitTarihi\":\"27.12.2025 01:20:07\"},{\"id\":\"1767002519356\",\"cekiciPlaka\":\"35 BNV 523 \",\"dorsePlaka\":\"01 AHZ 298\",\"soforAdi\":\"ALİ \",\"soforSoyadi\":\"GÖLCÜK\",\"sofor2Adi\":\"\",\"sofor2Soyadi\":\"\",\"iletisim\":\"0507 031 37 31\",\"tcKimlik\":\"16348359908\",\"defaultFirma\":\"\",\"defaultMalzeme\":\"\",\"defaultSevkYeri\":\"\",\"defaultYuklemeNotu\":\"\",\"kayitTarihi\":\"29.12.2025 13:01:59\"},{\"id\":\"1767002786859\",\"cekiciPlaka\":\"35 BIL 903\",\"dorsePlaka\":\"35 AGM 949\",\"soforAdi\":\"RASİM \",\"soforSoyadi\":\"TURHAN\",\"sofor2Adi\":\"\",\"sofor2Soyadi\":\"\",\"iletisim\":\"0552 400 70 78\",\"tcKimlik\":\"45964615280\",\"defaultFirma\":\"\",\"defaultMalzeme\":\"\",\"defaultSevkYeri\":\"\",\"defaultYuklemeNotu\":\"\",\"kayitTarihi\":\"29.12.2025 13:06:26\"},{\"id\":\"1767006131926\",\"cekiciPlaka\":\"43 HT 955\",\"dorsePlaka\":\"43 AEK 860\",\"soforAdi\":\"MEHMET ALİ\",\"soforSoyadi\":\" ACAR \",\"sofor2Adi\":\"\",\"sofor2Soyadi\":\"\",\"iletisim\":\"0537 810 59 91\",\"tcKimlik\":\"44797610738\",\"defaultFirma\":\"\",\"defaultMalzeme\":\"\",\"defaultSevkYeri\":\"\",\"defaultYuklemeNotu\":\"\",\"kayitTarihi\":\"29.12.2025 14:02:11\"},{\"id\":\"1767077337063\",\"cekiciPlaka\":\"43 AGK 142\",\"dorsePlaka\":\"43 ABD 944\",\"soforAdi\":\"SEYFETTİN \",\"soforSoyadi\":\"KOYUN\",\"sofor2Adi\":\"\",\"sofor2Soyadi\":\"\",\"iletisim\":\"0536 706 00 43\",\"tcKimlik\":\"63067004848\",\"defaultFirma\":\"\",\"defaultMalzeme\":\"\",\"defaultSevkYeri\":\"\",\"defaultYuklemeNotu\":\"\",\"kayitTarihi\":\"30.12.2025 09:48:57\"},{\"id\":\"1767090209649\",\"cekiciPlaka\":\"03 VH 007\",\"dorsePlaka\":\"03 VH 027\",\"soforAdi\":\"MURAT GÜLENÇ\",\"soforSoyadi\":\"\",\"sofor2Adi\":\"\",\"sofor2Soyadi\":\"\",\"iletisim\":\"0549 313 03 00\",\"tcKimlik\":\"10177565608\",\"defaultFirma\":\"\",\"defaultMalzeme\":\"\",\"defaultSevkYeri\":\"\",\"defaultYuklemeNotu\":\"\",\"kayitTarihi\":\"30.12.2025 13:23:29\"},{\"id\":\"1767092433046\",\"cekiciPlaka\":\"03 SH 575\",\"dorsePlaka\":\"03 SH 574\",\"soforAdi\":\"REMZİ \",\"soforSoyadi\":\"BALCI\",\"sofor2Adi\":\"\",\"sofor2Soyadi\":\"\",\"iletisim\":\"0536 876 76 47\",\"tcKimlik\":\"14764413044\",\"defaultFirma\":\"\",\"defaultMalzeme\":\"\",\"defaultSevkYeri\":\"\",\"defaultYuklemeNotu\":\"\",\"kayitTarihi\":\"30.12.2025 14:00:33\"},{\"id\":\"1767092637398\",\"cekiciPlaka\":\"03 ACM 382\",\"dorsePlaka\":\"03 ABT 15\",\"soforAdi\":\"SEDAT \",\"soforSoyadi\":\"BALCI\",\"sofor2Adi\":\"\",\"sofor2Soyadi\":\"\",\"iletisim\":\"0507 381 07 56\",\"tcKimlik\":\"14620417858\",\"defaultFirma\":\"\",\"defaultMalzeme\":\"\",\"defaultSevkYeri\":\"\",\"defaultYuklemeNotu\":\"\",\"kayitTarihi\":\"30.12.2025 14:03:57\"},{\"id\":\"1767100183263\",\"cekiciPlaka\":\"03 YB 448\",\"dorsePlaka\":\"03 ACY 799\",\"soforAdi\":\"RAMAZAN \",\"soforSoyadi\":\"BALCI\",\"sofor2Adi\":\"\",\"sofor2Soyadi\":\"\",\"iletisim\":\"0535 423 74 85\",\"tcKimlik\":\"14572419474\",\"defaultFirma\":\"\",\"defaultMalzeme\":\"\",\"defaultSevkYeri\":\"\",\"defaultYuklemeNotu\":\"\",\"kayitTarihi\":\"30.12.2025 16:09:43\"},{\"id\":\"1767100365661\",\"cekiciPlaka\":\"03 AGD 176\",\"dorsePlaka\":\"03 AGD 746\",\"soforAdi\":\"HASAN \",\"soforSoyadi\":\"GÜL\",\"sofor2Adi\":\"\",\"sofor2Soyadi\":\"\",\"iletisim\":\"0542 315 24 04\",\"tcKimlik\":\"11425524026\",\"defaultFirma\":\"\",\"defaultMalzeme\":\"\",\"defaultSevkYeri\":\"\",\"defaultYuklemeNotu\":\"\",\"kayitTarihi\":\"30.12.2025 16:12:45\"},{\"id\":\"1767104147568\",\"cekiciPlaka\":\"03 FZ 944\",\"dorsePlaka\":\"03 AIS 622\",\"soforAdi\":\"ÖMER ALİ \",\"soforSoyadi\":\"KELEŞ\",\"sofor2Adi\":\"\",\"sofor2Soyadi\":\"\",\"iletisim\":\"0539 748 06 26\",\"tcKimlik\":\"15607353572\",\"defaultFirma\":\"\",\"defaultMalzeme\":\"\",\"defaultSevkYeri\":\"\",\"defaultYuklemeNotu\":\"\",\"kayitTarihi\":\"30.12.2025 17:15:47\"},{\"id\":\"1767159181663\",\"cekiciPlaka\":\"01 ASD 756\",\"dorsePlaka\":\"01 AOT 480\",\"soforAdi\":\"RAMAZAN ÜNVER\",\"soforSoyadi\":\"\",\"sofor2Adi\":\"\",\"sofor2Soyadi\":\"\",\"iletisim\":\"0551 395 07 51\",\"tcKimlik\":\"30641244150\",\"defaultFirma\":\"\",\"defaultMalzeme\":\"\",\"defaultSevkYeri\":\"\",\"defaultYuklemeNotu\":\"\",\"kayitTarihi\":\"31.12.2025 08:33:01\"},{\"id\":\"1767159481588\",\"cekiciPlaka\":\"06 FAY.148\",\"dorsePlaka\":\"06FOF241\",\"soforAdi\":\"FAYRETTİN YALÇIN\",\"soforSoyadi\":\"\",\"sofor2Adi\":\"\",\"sofor2Soyadi\":\"\",\"iletisim\":\"0532 460 46 00\",\"tcKimlik\":\"10813207458\",\"defaultFirma\":\"\",\"defaultMalzeme\":\"\",\"defaultSevkYeri\":\"\",\"defaultYuklemeNotu\":\"\",\"kayitTarihi\":\"31.12.2025 08:38:01\"},{\"id\":\"1767160880858\",\"cekiciPlaka\":\"43 ADG 910\",\"dorsePlaka\":\"43 SE 976\",\"soforAdi\":\"MURAT UCKUN\",\"soforSoyadi\":\"\",\"sofor2Adi\":\"\",\"sofor2Soyadi\":\"\",\"iletisim\":\"0543 475 13 73\",\"tcKimlik\":\"53554318138\",\"defaultFirma\":\"\",\"defaultMalzeme\":\"\",\"defaultSevkYeri\":\"\",\"defaultYuklemeNotu\":\"\",\"kayitTarihi\":\"31.12.2025 09:01:20\"},{\"id\":\"1767337329394\",\"cekiciPlaka\":\"43 ED 712\",\"dorsePlaka\":\"\",\"soforAdi\":\"YÜKSEL \",\"soforSoyadi\":\"ÇEKİLMEZ \",\"sofor2Adi\":\"\",\"sofor2Soyadi\":\"\",\"iletisim\":\"0537 653 68 85\",\"tcKimlik\":\"23932977226\",\"defaultFirma\":\"\",\"defaultMalzeme\":\"\",\"defaultSevkYeri\":\"\",\"defaultYuklemeNotu\":\"\",\"kayitTarihi\":\"02.01.2026 10:02:09\"},{\"id\":\"1767337895294\",\"cekiciPlaka\":\"43 AY 870\",\"dorsePlaka\":\"43 AGA 359\",\"soforAdi\":\"HALİL \",\"soforSoyadi\":\"ÖZİRKİN\",\"sofor2Adi\":\"\",\"sofor2Soyadi\":\"\",\"iletisim\":\"0534 591 39 63\",\"tcKimlik\":\"53065335112\",\"defaultFirma\":\"\",\"defaultMalzeme\":\"\",\"defaultSevkYeri\":\"\",\"defaultYuklemeNotu\":\"\",\"kayitTarihi\":\"02.01.2026 10:11:35\"},{\"id\":\"1767338184420\",\"cekiciPlaka\":\"43 ED 334 \",\"dorsePlaka\":\"43 DH 457\",\"soforAdi\":\"MUSTAFA \",\"soforSoyadi\":\"YEL\",\"sofor2Adi\":\"\",\"sofor2Soyadi\":\"\",\"iletisim\":\"0543 534 08 69\",\"tcKimlik\":\"38209824714\",\"defaultFirma\":\"\",\"defaultMalzeme\":\"\",\"defaultSevkYeri\":\"\",\"defaultYuklemeNotu\":\"\",\"kayitTarihi\":\"02.01.2026 10:16:24\"},{\"id\":\"1767355395753\",\"cekiciPlaka\":\"43 ADP 256\",\"dorsePlaka\":\"43AEL920\",\"soforAdi\":\"TUNCAY \",\"soforSoyadi\":\"PEHLİVAN\",\"sofor2Adi\":\"\",\"sofor2Soyadi\":\"\",\"iletisim\":\"0530 171 99 32\",\"tcKimlik\":\"19025463202\",\"defaultFirma\":\"\",\"defaultMalzeme\":\"\",\"defaultSevkYeri\":\"\",\"defaultYuklemeNotu\":\"\",\"kayitTarihi\":\"02.01.2026 15:03:15\"}],\"firmalar\":[\"T171\",\"CRP13\",\"GK340\",\"İ109\",\"K1\",\"Y43\",\"G14\",\"G12\",\"K18\",\"Y68\",\"CR6\",\"MD1\",\"HP9\",\"YD226\",\"YD256\",\"YD190\",\"HP13\",\"HP18\",\"HP3 GÖLABŞI\",\"YD40\",\"YD164\",\"\",\"HP60\",\"HP34 KONYA\",\"HP34 KOCAELİ\",\"HP22\",\"HP2 ANKARA DÖKME\",\"HP3 GÖLBAŞI\",\"HP77\",\"HP2 TURGUTLU\",\"HP11\",\"YD05 PO:C2510-A1500\",\"YD05\",\"YD113\",\"YD05 PO:C2510-A1500E\",\"HP3 SİAS\",\"HP8\",\"HP5 / İSTANBUL\",\"HP22 / ANKARA\",\"HP2 TURGUTLU\",\"HP2 GEBZE\",\"HP7 ANKARA\",\"HP3 MERSİN\",\"YD92\",\"HP87\",\"HP7\",\"HP93\",\"YD01\",\"HP3 BOZÜYÜK\",\"HP8 / ANKARA\",\"HP11 / ANKARA\",\"HP77 / AKSARAY\",\"HP7  / ANKARA\",\"HP2 BALA\",\"HP2  / ANKARA/BALA/SİLOBAS\",\"HP2 / ANKARA\",\"HP2  / TURGUTLU-MANİSA\",\"HP22  / ANKARA\",\"HP9 / ESKİŞEHİR\",\"HP5 /İSTANBUL\",\"HP2\"],\"eslestirmeler\":[{\"id\":\"17673382859645b069b1ffb275\",\"firma\":\"T171\",\"malzeme\":\"P14\",\"ambalajBilgisi\":\"DÖKME\",\"yuklemeNotu\":\"\",\"sevkYeri\":\"YALOVA/MERKEZ\"},{\"id\":\"1767337927959033c3196a71338\",\"firma\":\"CRP13\",\"malzeme\":\"P05\",\"ambalajBilgisi\":\"YENİ BBT\",\"yuklemeNotu\":\"\",\"sevkYeri\":\"BİLECİK\"},{\"id\":\"1767337625365dcea901f56075\",\"firma\":\"GK340\",\"malzeme\":\"P12\",\"ambalajBilgisi\":\"\",\"yuklemeNotu\":\"\",\"sevkYeri\":\"\"},{\"id\":\"1767190031766b810daf86bd67\",\"firma\":\"İ109\",\"malzeme\":\"P14\",\"ambalajBilgisi\":\"200 DCLİK BASKILI LAMİNELİ\",\"yuklemeNotu\":\"\",\"sevkYeri\":\"ISPARTA\"},{\"id\":\"17671879928778cecfd12c0ee9\",\"firma\":\"K1\",\"malzeme\":\"P2 (PB140-9)\",\"ambalajBilgisi\":\"SP\",\"yuklemeNotu\":\"(SEVK İRSALİYESİNE SİPARİŞ NO: 158634 KALEM KODU: 010006036 SİPARİŞİ VEREN KİŞİ: EZGİ BEKTAŞ, BİLGİLERİNİ NOT EDELİM). ANALİZ SERTİFİKASINI ARAÇ İLE BİRLİKTE ÇIKARTALIM. İRSALİYE KESİLİRKEN TEK KALEM MALZEME OLARAK ÇIKIŞ YAPILMALIDIR. PALETİ VEYA BİGBAG AYRI KALEM OLARAK İRSALİYEYE GİRİLDİĞİNDE FİRMA KABUL ETMİYOR.\",\"sevkYeri\":\"ADAPAZARI\"},{\"id\":\"176718796481483d0f1a63e2408\",\"firma\":\"Y43\",\"malzeme\":\"P2 (PE230-13)\",\"ambalajBilgisi\":\"SP\",\"yuklemeNotu\":\"MSDS VE TDS BELGELERİ ARAÇ İLE BİRLİKTE ÇIKARTILMALIDIR.\",\"sevkYeri\":\"GAZİANTEP\"},{\"id\":\"1767187507921f2c5789c976ab8\",\"firma\":\"G14\",\"malzeme\":\"P2 (PB180-13)\",\"ambalajBilgisi\":\"BBT + PALET\",\"yuklemeNotu\":\"ARACA YÜKLEME 9.000-10.000 KG ARASI YAPILACAKTIR\",\"sevkYeri\":\"ADANA / SARIÇAM\"},{\"id\":\"176718734882676d1433bc810d\",\"firma\":\"G12\",\"malzeme\":\"P2 (PB180-13)\",\"ambalajBilgisi\":\"SP\",\"yuklemeNotu\":\"NAKLİYE HİZMET BEDELİ AYRI İRSALİYEDE KG CİNSİNDEN GİRİLMELİDİR.\",\"sevkYeri\":\"GAZİANTEP\"},{\"id\":\"17671854269873895eec487a5a8\",\"firma\":\"K18\",\"malzeme\":\"P2 (PA170-12)\",\"ambalajBilgisi\":\"SP\",\"yuklemeNotu\":\"22 PALET ÇUVALLI OLARAK YÜKLEME YAPILACAKTIR.\",\"sevkYeri\":\"ADANA / SARIÇAM\"},{\"id\":\"1767177800680cd177bb9e62a4\",\"firma\":\"Y68\",\"malzeme\":\"P2(PB140-9)\",\"ambalajBilgisi\":\"SP\",\"yuklemeNotu\":\"ARAÇ GELDİĞİNDE BİLGİ VERİLMESİ ÖNEMLE RİCA OLUNUR.\",\"sevkYeri\":\"MERSİN\"},{\"id\":\"1767161216791d11d137125e07\",\"firma\":\"CR6\",\"malzeme\":\"P05\",\"ambalajBilgisi\":\"SİLOBAS\",\"yuklemeNotu\":\"\",\"sevkYeri\":\"BALIKESİR\"},{\"id\":\"17671609183621e543bf09b1d6\",\"firma\":\"MD1\",\"malzeme\":\"P2\",\"ambalajBilgisi\":\"\",\"yuklemeNotu\":\"SİLOBAS\",\"sevkYeri\":\"GÜMÜŞKÖY\"},{\"id\":\"17670941845897367935eea2258\",\"firma\":\"HP9\",\"malzeme\":\"HP 0,15-0,60\",\"ambalajBilgisi\":\"\",\"yuklemeNotu\":\"SİLOBAS\",\"sevkYeri\":\"EŞKİŞEHİR\"},{\"id\":\"176707830051164a0a965b7d5c\",\"firma\":\"YD226\",\"malzeme\":\"HP 0.60-1.20\",\"ambalajBilgisi\":\"BASKISIZ LİNERSIZ BIGBAG\",\"yuklemeNotu\":\"10 ADET SEPARATÖR ATILACAK\",\"sevkYeri\":\"RODAPORT\"},{\"id\":\"176707816113698fc6efd90fc08\",\"firma\":\"YD226\",\"malzeme\":\"HP 1,20-2,80\",\"ambalajBilgisi\":\"BASKISIZ LİNERSIZ BIGBAG\",\"yuklemeNotu\":\"10 ADET SEPARATÖR ATILACAK\",\"sevkYeri\":\"RODAPORT\"},{\"id\":\"17670780551744e8746637270c8\",\"firma\":\"YD256\",\"malzeme\":\"HP 0,35-0,85\",\"ambalajBilgisi\":\"\",\"yuklemeNotu\":\"1250 KG BASKISIZ LİNEERSİZ (SİYAH DİKİŞLİ/KULPLU)\",\"sevkYeri\":\"DP WORLD\"},{\"id\":\"1767077988065a422fcc6f51ca\",\"firma\":\"YD256\",\"malzeme\":\"HP 0,30-0,85\",\"ambalajBilgisi\":\"NET 1250 KG BASKISIZ LİNEERSİZ (SİYAH DİKİŞLİ\",\"yuklemeNotu\":\"1250 KG BASKISIZ LİNEERSİZ (SİYAH DİKİŞLİ/KULPLU)\",\"sevkYeri\":\"DP WORLD\"},{\"id\":\"1767077504151a794339767d4d8\",\"firma\":\"YD92\",\"malzeme\":\"HP 0.30-0.85\",\"ambalajBilgisi\":\"\",\"yuklemeNotu\":\"ET 1250 KG BASKISIZ LİNEERSİZ (SİYAH DİKİŞLİ/KULPLU)\",\"sevkYeri\":\"DP WORLD\"},{\"id\":\"1767077204073bd95e3032cdef\",\"firma\":\"YD256\",\"malzeme\":\"HP 0,30-0.85\",\"ambalajBilgisi\":\"ET 1250 KG BASKISIZ LİNEERSİZ\",\"yuklemeNotu\":\"NET 1250 KG BASKISIZ LİNEERSİZ (SİYAH DİKİŞLİ/KULPLU)\",\"sevkYeri\":\"DP WORLD\"},{\"id\":\"17670723373911db8490088faa\",\"firma\":\"YD190\",\"malzeme\":\"HP 1,20-2,80\",\"ambalajBilgisi\":\"NET 25 KG BASKILI ÇUVALLAR BİGBAGE İSTİFLİ\",\"yuklemeNotu\":\"\",\"sevkYeri\":\"EVYAP\"},{\"id\":\"1767010464266d11f8e51ecbb78\",\"firma\":\"HP3 SİAS\",\"malzeme\":\"HP 0,15-0,60\",\"ambalajBilgisi\":\"0.BBT\",\"yuklemeNotu\":\"0.BBT\",\"sevkYeri\":\"SİVAS\"},{\"id\":\"1767007808503a1c25d7b8cf738\",\"firma\":\"HP13\",\"malzeme\":\"HP 0,15-0,60\",\"ambalajBilgisi\":\"\",\"yuklemeNotu\":\"\",\"sevkYeri\":\"\"},{\"id\":\"1767007773511c28e3d07295e1\",\"firma\":\"HP13\",\"malzeme\":\"HP 0.60-1.40 YUMUŞAK\",\"ambalajBilgisi\":\"\",\"yuklemeNotu\":\"\",\"sevkYeri\":\"\"},{\"id\":\"17670077151971a13b33bc49e5\",\"firma\":\"HP13\",\"malzeme\":\"HP 0.60-1.40 SERT\",\"ambalajBilgisi\":\"\",\"yuklemeNotu\":\"\",\"sevkYeri\":\"\"},{\"id\":\"1767006187041a53fdaef39b67\",\"firma\":\"HP18\",\"malzeme\":\"HP 0,074-0,30\",\"ambalajBilgisi\":\"\",\"yuklemeNotu\":\"YENİ BBT\",\"sevkYeri\":\"ESKİŞEHİR\"},{\"id\":\"1767002136026f9af0baae91478\",\"firma\":\"HP3 GÖLBAŞI\",\"malzeme\":\"HP 0.15-0.60 (615)\",\"ambalajBilgisi\":\"\",\"yuklemeNotu\":\"YENİ BBT\",\"sevkYeri\":\"ANKARA\"},{\"id\":\"1766988022379c1bd769b447758\",\"firma\":\"YD40\",\"malzeme\":\"HP 0,074-0,60\",\"ambalajBilgisi\":\"NET 1350 KG BASKILI LINERLI BIGBAG\",\"yuklemeNotu\":\"\",\"sevkYeri\":\"EVYAP\"},{\"id\":\"17667876380434a5d451ac00d3\",\"firma\":\"HP8\",\"malzeme\":\"HP 0.15-0.60\",\"ambalajBilgisi\":\"\",\"yuklemeNotu\":\"SİLOBAS\",\"sevkYeri\":\"ANKARA\"},{\"id\":\"1766712407671cc6ed9f3a7acc8\",\"firma\":\"YD164\",\"malzeme\":\"HP 0,15-0,60\",\"ambalajBilgisi\":\"\",\"yuklemeNotu\":\"\",\"sevkYeri\":\"DP WORLD\"},{\"id\":\"1766462418168e5a408b6009708\",\"firma\":\"HP2 TURGUTLU\",\"malzeme\":\"HP 0.15-0.60\",\"ambalajBilgisi\":\"\",\"yuklemeNotu\":\"DÖKME\",\"sevkYeri\":\"TURGUTLU\"},{\"id\":\"1766459150931340e1b862e5e4\",\"firma\":\"HP60\",\"malzeme\":\"H-150\",\"ambalajBilgisi\":\"0.BBT\",\"yuklemeNotu\":\"0.BBT\",\"sevkYeri\":\"ELAZIĞ\"},{\"id\":\"176645900574751512a348d8c2\",\"firma\":\"HP34 KONYA\",\"malzeme\":\"HP 0.30-0.85\",\"ambalajBilgisi\":\"\",\"yuklemeNotu\":\"\",\"sevkYeri\":\"\"},{\"id\":\"1766458775789b9af43caffa958\",\"firma\":\"HP34 KOCAELİ\",\"malzeme\":\"HP 0.60-1.40\",\"ambalajBilgisi\":\"\",\"yuklemeNotu\":\"\",\"sevkYeri\":\"\"},{\"id\":\"1766458418724f76e9c846352e\",\"firma\":\"HP3 BOZÜYÜK\",\"malzeme\":\"HP 0.15-0.60\",\"ambalajBilgisi\":\"SİLOBAS\",\"yuklemeNotu\":\"SİLOBAS-ANALİZ VERİLECEK\",\"sevkYeri\":\"BOZÜYÜK\"},{\"id\":\"1766458270948abbe25b7956fa8\",\"firma\":\"HP2 BALA\",\"malzeme\":\"HP 0.15-0.60\",\"ambalajBilgisi\":\"SİLOBAS\",\"yuklemeNotu\":\"SİLOBAS\",\"sevkYeri\":\"ANKARA-BALA\"},{\"id\":\"17664581158441ee14ac7fccea8\",\"firma\":\"HP7 ANKARA\",\"malzeme\":\"HP 0.15-0.60\",\"ambalajBilgisi\":\"SİLOBAS\",\"yuklemeNotu\":\"SİLOBAS\",\"sevkYeri\":\"ANKARA\"},{\"id\":\"17664580091256e95e09978c208\",\"firma\":\"HP2 GEBZE\",\"malzeme\":\"HP 0.15-0.60\",\"ambalajBilgisi\":\"DÖKME\",\"yuklemeNotu\":\"DÖKME\",\"sevkYeri\":\"GEBZE KOCAELİ\"},{\"id\":\"1766457950020138af39eee3d5\",\"firma\":\"HP22\",\"malzeme\":\"HP 0.15-0.60(615)\",\"ambalajBilgisi\":\"0.BBT\",\"yuklemeNotu\":\"0.BBT\",\"sevkYeri\":\"ANKARA\"},{\"id\":\"1766457775853ed5ee055e1f2f\",\"firma\":\"HP3 MERSİN\",\"malzeme\":\"HP 0.15-0.60\",\"ambalajBilgisi\":\"0.BBT\",\"yuklemeNotu\":\"0.BBT\",\"sevkYeri\":\"MERSİN\"},{\"id\":\"17664575621259207232ca81e28\",\"firma\":\"HP2 ANKARA DÖKME\",\"malzeme\":\"HP 0.15-0.60\",\"ambalajBilgisi\":\"\",\"yuklemeNotu\":\"DÖKME\",\"sevkYeri\":\"ANKARA GÖLBAŞI\"},{\"id\":\"1766457090301225fd8e0c83f8\",\"firma\":\"HP77\",\"malzeme\":\"HP 0.15-0.60\",\"ambalajBilgisi\":\"\",\"yuklemeNotu\":\"YENİ BBT\",\"sevkYeri\":\"AKSARAY\"},{\"id\":\"17664570308777818032a72396\",\"firma\":\"HP2\",\"malzeme\":\"HP 0.15-0.60\",\"ambalajBilgisi\":\"\",\"yuklemeNotu\":\"DÖKME\",\"sevkYeri\":\"ANKARA\"},{\"id\":\"17664569661182a23ed0929167\",\"firma\":\"HP11\",\"malzeme\":\"HP 0.074-0.30\",\"ambalajBilgisi\":\"\",\"yuklemeNotu\":\"YENİ BBT\",\"sevkYeri\":\"ANKARA\"},{\"id\":\"17664567812216cf635f872f1e\",\"firma\":\"HP7\",\"malzeme\":\"HP 0.15-0.60\",\"ambalajBilgisi\":\"\",\"yuklemeNotu\":\"SİLOBAS\",\"sevkYeri\":\"ANKARA\"},{\"id\":\"1766174070857201366fdf159b\",\"firma\":\"HP87\",\"malzeme\":\"HP 0.00-4.00\",\"ambalajBilgisi\":\"\",\"yuklemeNotu\":\"\"}],\"malzemeler\":[\"P12\",\"P14\",\"P2 (PB140-9)\",\"P2 (PE230-13)\",\"P2 (PB180-13)\",\"P2 (PA170-12)\",\"P2(PB140-9)\",\"P05\",\"P2\",\"HP 0,35-0,85\",\"HP 0,30-0,85\",\"HP 0,30-0.85\",\"HP 1,20-2,80\",\"HP 0.60-1.40 YUMUŞAK\",\"HP 0.60-1.40 SERT\",\"HP 0.15-0.60 (615)\",\"HP 0,074-0,60\",\"HP 0,15-0,60\",\"HP 548\",\"H-150\",\"HP 0.60-1.40\",\"HP 0.15-0.60(615)\",\"(615)\",\"HP 0.60-1.20 (615)\",\"HP 0,074-0,30\",\"HP 0.00-4.00\",\"HP 0.074-0.30\",\"HP 0.074-0.60\",\"HP 0.15-0.30\",\"HP 0.15-0.40\",\"HP 0.15-0.60\",\"HP 0.30-0.50\",\"HP 0.30-0.85\",\"HP 0.60-1.20\",\"HP 1.20-2.40\",\"HP 1.20-2.80\",\"HP 1.60-4.00\"]}",
    "auto_backup_2026-01-08": "{\"ts\":\"2026-01-07T21:07:06.782Z\",\"vehicles\":[{\"id\":\"1765890505225\",\"cekiciPlaka\":\"01 AOJ 996\",\"dorsePlaka\":\"33 NA 932\",\"soforAdi\":\"HARUN\",\"soforSoyadi\":\"KUŞCU\",\"iletisim\":\"0533 215 46 63\",\"tcKimlik\":\"10996320044\",\"kantarPersoneli\":\"BUKA\",\"kayitTarihi\":\"16.12.2025 16:08:25\",\"kayitDateKey\":\"2025-12-16\",\"printCount\":0,\"lastPrintedAt\":0},{\"id\":\"1766138256845\",\"cekiciPlaka\":\"43 AFG 950\",\"dorsePlaka\":\"43 AFJ 071\",\"soforAdi\":\"ALİ \",\"soforSoyadi\":\"KESKİN\",\"iletisim\":\"0530 849 88 57\",\"tcKimlik\":\"10094763088\",\"kantarPersoneli\":\"BK\",\"kayitTarihi\":\"19.12.2025 12:57:36\",\"kayitDateKey\":\"2025-12-19\",\"printCount\":0,\"lastPrintedAt\":0},{\"id\":\"1763376547521\",\"cekiciPlaka\":\"03 ADK 147\",\"dorsePlaka\":\"03 VK 878\",\"soforAdi\":\"HİKMET\",\"soforSoyadi\":\"ERATA\",\"iletisim\":\"0536 604 53 90\",\"tcKimlik\":\"48640529918\",\"kayitTarihi\":\"17.11.2025 13:49:07\",\"kantarPersoneli\":\"Burak Karataş\",\"kayitDateKey\":\"2025-11-17\",\"printCount\":0,\"lastPrintedAt\":0},{\"id\":\"1763080013066\",\"cekiciPlaka\":\"43 HP 433\",\"dorsePlaka\":\"34 ZFP 78\",\"soforAdi\":\"ZÜLFÜ\",\"soforSoyadi\":\"USLU\",\"iletisim\":\"0542 508 43 02\",\"tcKimlik\":\"30233102240\",\"kayitTarihi\":\"14.11.2025 03:26:53\",\"kantarPersoneli\":\"Burak Karataş\",\"kayitDateKey\":\"2025-11-14\",\"printCount\":0,\"lastPrintedAt\":0},{\"id\":\"1764363806566\",\"cekiciPlaka\":\"35 VNP 36\",\"dorsePlaka\":\"35 AGM 949\",\"soforAdi\":\"FİKRET\",\"soforSoyadi\":\" ERGÖNÜL\",\"iletisim\":\"0532 611 31 43\",\"tcKimlik\":\"15407406614\",\"kantarPersoneli\":\"bk\",\"kayitTarihi\":\"29.11.2025 00:03:26\",\"kayitDateKey\":\"2025-11-29\",\"printCount\":0,\"lastPrintedAt\":0},{\"id\":\"1763556459634\",\"cekiciPlaka\":\"01 ALN 562\",\"dorsePlaka\":\"01 ATS 180\",\"soforAdi\":\"SELÇUK\",\"soforSoyadi\":\"ŞAHİN\",\"iletisim\":\"0539 664 02 45\",\"tcKimlik\":\"14548279224\",\"kayitTarihi\":\"19.11.2025 15:47:39\",\"kantarPersoneli\":\"Burak Karataş\",\"kayitDateKey\":\"2025-11-19\",\"printCount\":0,\"lastPrintedAt\":0,\"lastPrintSnapshot\":{\"ts\":1767566450927,\"firmaSelect\":\"\",\"firmaKodu\":\"G14\",\"malzemeSelect\":\"\",\"malzeme\":\"P2 (PB180-13)\",\"sevkYeri\":\"ADANA / SARIÇAM\",\"ambalajBilgisi\":\"BBT + PALET\",\"tonaj\":\"(9.000 - 10.000) KG\",\"yuklemeSirasi\":\"1\",\"yuklemeNotu\":\"ARACA YÜKLEME 9.000-10.000 KG ARASI YAPILACAKTIR\"}},{\"id\":\"1766130217865\",\"cekiciPlaka\":\"43 AFT 542\",\"dorsePlaka\":\"43 AGY 640\",\"soforAdi\":\"ALİ \",\"soforSoyadi\":\"ZEYBEK\",\"iletisim\":\"0546 286 00 43\",\"tcKimlik\":\"50764406204\",\"kantarPersoneli\":\"\",\"kayitTarihi\":\"19.12.2025 10:43:37\",\"kayitDateKey\":\"2025-12-19\",\"printCount\":0,\"lastPrintedAt\":0},{\"id\":\"1764192200252\",\"cekiciPlaka\":\"43 AHC 297\",\"dorsePlaka\":\"43 AHE 944\",\"soforAdi\":\"VEYSEL\",\"soforSoyadi\":\"GÖKÇE\",\"iletisim\":\"0537 660 01 35\",\"tcKimlik\":\"50653409002\",\"kantarPersoneli\":\"BK\",\"kayitTarihi\":\"27.11.2025 00:23:20\",\"kayitDateKey\":\"2025-11-27\",\"printCount\":0,\"lastPrintedAt\":0},{\"id\":\"1763077961882\",\"cekiciPlaka\":\"43 ABH 376\",\"dorsePlaka\":\"43 RS 798\",\"soforAdi\":\"MUHSİN\",\"soforSoyadi\":\"TANRIKUL\",\"iletisim\":\"0533 649 77 85\",\"tcKimlik\":\"56164231998\",\"kayitTarihi\":\"14.11.2025 02:52:41\",\"kantarPersoneli\":\"Burak Karataş\",\"kayitDateKey\":\"2025-11-14\",\"printCount\":0,\"lastPrintedAt\":0},{\"id\":\"1763076803155\",\"cekiciPlaka\":\"03 AEZ 755\",\"dorsePlaka\":\"20 GA 729\",\"soforAdi\":\"HALİL \",\"soforSoyadi\":\"MERCAN\",\"iletisim\":\"0546 931 34 36\",\"tcKimlik\":\"16153336828\",\"kayitTarihi\":\"14.11.2025 02:33:23\",\"kantarPersoneli\":\"Burak Karataş\",\"kayitDateKey\":\"2025-11-14\",\"printCount\":0,\"lastPrintedAt\":0},{\"id\":\"1763715260156\",\"cekiciPlaka\":\"43 AEF 937\",\"dorsePlaka\":\"43 NR 334\",\"soforAdi\":\"HAKKI\",\"soforSoyadi\":\"AKDUMAN\",\"iletisim\":\"0555 022 75 53\",\"tcKimlik\":\"29918107052\",\"kayitTarihi\":\"21.11.2025 11:54:20\",\"kantarPersoneli\":\"Burak Karataş\",\"kayitDateKey\":\"2025-11-21\",\"printCount\":0,\"lastPrintedAt\":0},{\"id\":\"1764761727327\",\"cekiciPlaka\":\"43 AK 877\",\"dorsePlaka\":\"43 AAS 563\",\"soforAdi\":\"NEJDET\",\"soforSoyadi\":\"AKCAY\",\"iletisim\":\"0507 779 55 10\",\"tcKimlik\":\"30665081380\",\"kantarPersoneli\":\"BK\",\"kayitTarihi\":\"03.12.2025 14:35:27\",\"kayitDateKey\":\"2025-12-03\",\"printCount\":0,\"lastPrintedAt\":0},{\"id\":\"1763077173618\",\"cekiciPlaka\":\"16 AAT 58\",\"dorsePlaka\":\"16 AAJ 58\",\"soforAdi\":\"ÖMER\",\"soforSoyadi\":\"ATAÇ\",\"iletisim\":\"0540 250 16 49\",\"tcKimlik\":\"51763522124\",\"kayitTarihi\":\"14.11.2025 02:39:33\",\"kantarPersoneli\":\"Burak Karataş\",\"kayitDateKey\":\"2025-11-14\",\"printCount\":0,\"lastPrintedAt\":0},{\"id\":\"1763155610946\",\"cekiciPlaka\":\"43 ABM 753\",\"dorsePlaka\":\"43 KY 921\",\"soforAdi\":\"MEHMET\",\"soforSoyadi\":\"ÖZTÜRK\",\"iletisim\":\"0541 662 45 46\",\"tcKimlik\":\"58003166278\",\"kayitTarihi\":\"15.11.2025 00:26:50\",\"kantarPersoneli\":\"Burak Karataş\",\"kayitDateKey\":\"2025-11-15\",\"printCount\":0,\"lastPrintedAt\":0},{\"id\":\"1763072523243\",\"cekiciPlaka\":\"43 UL 450\",\"dorsePlaka\":\"43 PK 943\",\"soforAdi\":\"TUNAY\",\"soforSoyadi\":\"TEZLİK\",\"iletisim\":\"0544 643 41 52\",\"tcKimlik\":\"21851542198\",\"kayitTarihi\":\"14.11.2025 01:22:03\",\"kantarPersoneli\":\"Burak Karataş\",\"kayitDateKey\":\"2025-11-14\",\"printCount\":0,\"lastPrintedAt\":0},{\"id\":\"1763072879738\",\"cekiciPlaka\":\"43 ACJ 711\",\"dorsePlaka\":\"26 YA 490\",\"soforAdi\":\"HASAN HÜSEYİN\",\"soforSoyadi\":\"ERDİREN\",\"iletisim\":\"0546 957 64 28\",\"tcKimlik\":\"13535652224\",\"kayitTarihi\":\"14.11.2025 01:27:59\",\"kantarPersoneli\":\"Burak Karataş\",\"kayitDateKey\":\"2025-11-14\",\"printCount\":0,\"lastPrintedAt\":0},{\"id\":\"1763155912288\",\"cekiciPlaka\":\"41 YT 444\",\"dorsePlaka\":\"41 BAE 118\",\"soforAdi\":\"YÜKSEL\",\"soforSoyadi\":\"TURAN\",\"iletisim\":\"0541 234 41 61\",\"tcKimlik\":\"17243823976\",\"kayitTarihi\":\"15.11.2025 00:31:52\",\"kantarPersoneli\":\"Burak Karataş\",\"kayitDateKey\":\"2025-11-15\",\"printCount\":0,\"lastPrintedAt\":0},{\"id\":\"1763719337045\",\"cekiciPlaka\":\"64 AG 770\",\"dorsePlaka\":\"64 AG 701\",\"soforAdi\":\"AKIN \",\"soforSoyadi\":\"GÜLER\",\"iletisim\":\"0539 834 56 78\",\"tcKimlik\":\"63013332988\",\"kayitTarihi\":\"21.11.2025 13:02:17\",\"kantarPersoneli\":\"Burak Karataş\",\"kayitDateKey\":\"2025-11-21\",\"printCount\":0,\"lastPrintedAt\":0},{\"id\":\"1764192306676\",\"cekiciPlaka\":\"41 KC 400\",\"dorsePlaka\":\"41 EU 067\",\"soforAdi\":\"EMRE\",\"soforSoyadi\":\"UÇAR\",\"iletisim\":\"0532 489 41 67\",\"tcKimlik\":\"61492416700\",\"kantarPersoneli\":\"BK\",\"kayitTarihi\":\"27.11.2025 00:25:06\",\"kayitDateKey\":\"2025-11-27\",\"printCount\":0,\"lastPrintedAt\":0},{\"id\":\"1765886250431\",\"cekiciPlaka\":\"43KS292\",\"dorsePlaka\":\"43KS293\",\"soforAdi\":\"KADİR\",\"soforSoyadi\":\"AKKUŞ\",\"iletisim\":\"0532 050 30 43\",\"tcKimlik\":\"18308796920\",\"kantarPersoneli\":\"BUKA\",\"kayitTarihi\":\"16.12.2025 14:57:30\",\"kayitDateKey\":\"2025-12-16\",\"printCount\":0,\"lastPrintedAt\":0},{\"id\":\"1763077515523\",\"cekiciPlaka\":\"43 LU 628\",\"dorsePlaka\":\"43 LS 153\",\"soforAdi\":\"MUSTAFA\",\"soforSoyadi\":\"ÖZSAY\",\"iletisim\":\"0543 770 16 62\",\"tcKimlik\":\"49450460866\",\"kayitTarihi\":\"14.11.2025 02:45:15\",\"kantarPersoneli\":\"Burak Karataş\",\"kayitDateKey\":\"2025-11-14\",\"printCount\":0,\"lastPrintedAt\":0},{\"id\":\"1763072685362\",\"cekiciPlaka\":\"45 ZC 1272\",\"dorsePlaka\":\"43 AEL 615\",\"soforAdi\":\"YUNUS EMRE\",\"soforSoyadi\":\"TAMAN\",\"iletisim\":\"0541 283 95 19\",\"tcKimlik\":\"47818513018\",\"kayitTarihi\":\"14.11.2025 01:24:45\",\"kantarPersoneli\":\"Burak Karataş\",\"kayitDateKey\":\"2025-11-14\",\"printCount\":0,\"lastPrintedAt\":0},{\"id\":\"1764192347651\",\"cekiciPlaka\":\"03 NF 525\",\"dorsePlaka\":\"03 NE 770\",\"soforAdi\":\"HALİL\",\"soforSoyadi\":\"ATA\",\"iletisim\":\"0539 716 20 44\",\"tcKimlik\":\"21928141446\",\"kantarPersoneli\":\"BK\",\"kayitTarihi\":\"27.11.2025 00:25:47\",\"kayitDateKey\":\"2025-11-27\",\"printCount\":0,\"lastPrintedAt\":0},{\"id\":\"1763644494973\",\"cekiciPlaka\":\"35 BR 175\",\"dorsePlaka\":\"43 KJ 804\",\"soforAdi\":\"İSMAİL\",\"soforSoyadi\":\"CİNKILINC\",\"iletisim\":\"0546 928 33 70\",\"tcKimlik\":\"60556088570\",\"kayitTarihi\":\"20.11.2025 16:14:54\",\"kantarPersoneli\":\"Burak Karataş\",\"kayitDateKey\":\"2025-11-20\",\"printCount\":0,\"lastPrintedAt\":0},{\"id\":\"1765236207425\",\"cekiciPlaka\":\"43 AFE 840\",\"dorsePlaka\":\"43 AGA 981\",\"soforAdi\":\"SÜLEYMAN \",\"soforSoyadi\":\"ULUSOY\",\"iletisim\":\"0535 374 30 17\",\"tcKimlik\":\"34528953234\",\"kantarPersoneli\":\"BK\",\"kayitTarihi\":\"09.12.2025 02:23:27\",\"kayitDateKey\":\"2025-12-09\",\"printCount\":0,\"lastPrintedAt\":0},{\"id\":\"1763444993419\",\"cekiciPlaka\":\"01 HK 850\",\"dorsePlaka\":\"01 HK 165\",\"soforAdi\":\"MUSTAFA\",\"soforSoyadi\":\"KEDER\",\"iletisim\":\"0535 245 23 96\",\"tcKimlik\":\"10798437278\",\"kayitTarihi\":\"18.11.2025 08:49:53\",\"kantarPersoneli\":\"Burak Karataş\",\"kayitDateKey\":\"2025-11-18\",\"printCount\":0,\"lastPrintedAt\":0},{\"id\":\"1763076249435\",\"cekiciPlaka\":\"43 LT 713\",\"dorsePlaka\":\"43 LT 611\",\"soforAdi\":\"ÖZKAN\",\"soforSoyadi\":\"UÇARKUŞ\",\"iletisim\":\"0551 894 69 10\",\"tcKimlik\":\"72322021728\",\"kayitTarihi\":\"14.11.2025 02:24:09\",\"kantarPersoneli\":\"Burak Karataş\",\"kayitDateKey\":\"2025-11-14\",\"printCount\":0,\"lastPrintedAt\":0},{\"id\":\"1763634490245\",\"cekiciPlaka\":\"01 BT 968\",\"dorsePlaka\":\"01 BT 591\",\"soforAdi\":\"HALİL \",\"soforSoyadi\":\"KEDER\",\"iletisim\":\"0544 560 86 96\",\"tcKimlik\":\"40352076018\",\"kayitTarihi\":\"20.11.2025 13:28:10\",\"kantarPersoneli\":\"Burak Karataş\",\"kayitDateKey\":\"2025-11-20\",\"printCount\":0,\"lastPrintedAt\":0},{\"id\":\"1765879850058\",\"cekiciPlaka\":\"43RH420\",\"dorsePlaka\":\"43AFU056\",\"soforAdi\":\"ERCAN\",\"soforSoyadi\":\"AVCI\",\"iletisim\":\"0530 580 60 39\",\"tcKimlik\":\"47056529154\",\"kantarPersoneli\":\"BUKA\",\"kayitTarihi\":\"16.12.2025 13:10:50\",\"kayitDateKey\":\"2025-12-16\",\"printCount\":0,\"lastPrintedAt\":0},{\"id\":\"1763076327524\",\"cekiciPlaka\":\"01 ET 700\",\"dorsePlaka\":\"01 ET 166\",\"soforAdi\":\"SEZAİ \",\"soforSoyadi\":\"AVCI\",\"iletisim\":\"0541 443 41 39\",\"tcKimlik\":\"12043289635\",\"kayitTarihi\":\"14.11.2025 02:25:27\",\"kantarPersoneli\":\"Burak Karataş\",\"kayitDateKey\":\"2025-11-14\",\"printCount\":0,\"lastPrintedAt\":0},{\"id\":\"1763445030907\",\"cekiciPlaka\":\"01 PD 999\",\"dorsePlaka\":\"01 AAU 006\",\"soforAdi\":\"HASAN \",\"soforSoyadi\":\"KURT\",\"iletisim\":\"0543 227 34 63\",\"tcKimlik\":\"57943489188\",\"kayitTarihi\":\"18.11.2025 08:50:30\",\"kantarPersoneli\":\"Burak Karataş\",\"kayitDateKey\":\"2025-11-18\",\"printCount\":0,\"lastPrintedAt\":0},{\"id\":\"1766143580972\",\"cekiciPlaka\":\"43 AAB 518\",\"dorsePlaka\":\"42 LR 784\",\"soforAdi\":\"EFRAHİM \",\"soforSoyadi\":\"DEDE\",\"iletisim\":\"0536 452 91 77\",\"tcKimlik\":\"15476581748\",\"kantarPersoneli\":\"BD\",\"kayitTarihi\":\"19.12.2025 14:26:20\",\"kayitDateKey\":\"2025-12-19\",\"printCount\":0,\"lastPrintedAt\":0},{\"id\":\"1763075639195\",\"cekiciPlaka\":\"43 EY 222\",\"dorsePlaka\":\"43 AGJ 030\",\"soforAdi\":\"RAMAZAN\",\"soforSoyadi\":\"AYDIN\",\"iletisim\":\"0541 379 97 98\",\"tcKimlik\":\"43879638288\",\"kayitTarihi\":\"14.11.2025 02:13:59\",\"kantarPersoneli\":\"Burak Karataş\",\"kayitDateKey\":\"2025-11-14\",\"printCount\":0,\"lastPrintedAt\":0},{\"id\":\"1763155521769\",\"cekiciPlaka\":\"43 ACA 341\",\"dorsePlaka\":\"43 AB 542\",\"soforAdi\":\"RECEP\",\"soforSoyadi\":\"ÖĞÜT\",\"iletisim\":\"0542 786 22 04\",\"tcKimlik\":\"58849142528\",\"kayitTarihi\":\"15.11.2025 00:25:21\",\"kantarPersoneli\":\"Burak Karataş\",\"kayitDateKey\":\"2025-11-15\",\"printCount\":0,\"lastPrintedAt\":0},{\"id\":\"1764192399683\",\"cekiciPlaka\":\"43 ABU 203\",\"dorsePlaka\":\"43 ABZ 360\",\"soforAdi\":\"SÜLEYMAN\",\"soforSoyadi\":\"ÖZER\",\"iletisim\":\"0506 052 94 08\",\"tcKimlik\":\"59152138598\",\"kantarPersoneli\":\"BK\",\"kayitTarihi\":\"27.11.2025 00:26:39\",\"kayitDateKey\":\"2025-11-27\",\"printCount\":0,\"lastPrintedAt\":0},{\"id\":\"1764290647692\",\"cekiciPlaka\":\"43 AU 420\",\"dorsePlaka\":\"43 BC 420\",\"soforAdi\":\"ÖMER\",\"soforSoyadi\":\"TÜLÜKOÇ\",\"iletisim\":\"0546 598 97 90\",\"tcKimlik\":\"21314387144\",\"kantarPersoneli\":\"BK\",\"kayitTarihi\":\"28.11.2025 03:44:07\",\"kayitDateKey\":\"2025-11-28\",\"printCount\":0,\"lastPrintedAt\":0},{\"id\":\"1763078232043\",\"cekiciPlaka\":\"03 AHP 318\",\"dorsePlaka\":\"03 AHP 041\",\"soforAdi\":\"İBRAHİM\",\"soforSoyadi\":\"YANGIÇ\",\"iletisim\":\"0536 615 06 27\",\"tcKimlik\":\"25393058476\",\"kayitTarihi\":\"14.11.2025 02:57:12\",\"kantarPersoneli\":\"Burak Karataş\",\"kayitDateKey\":\"2025-11-14\",\"printCount\":0,\"lastPrintedAt\":0},{\"id\":\"1763155394465\",\"cekiciPlaka\":\"03 SK 904\",\"dorsePlaka\":\"03 AIR 777\",\"soforAdi\":\"ERSİN\",\"soforSoyadi\":\"EVRAN\",\"iletisim\":\"0538 830 43 57\",\"tcKimlik\":\"17068304896\",\"kayitTarihi\":\"15.11.2025 00:23:14\",\"kantarPersoneli\":\"Burak Karataş\",\"kayitDateKey\":\"2025-11-15\",\"printCount\":0,\"lastPrintedAt\":0},{\"id\":\"1763715930908\",\"cekiciPlaka\":\"03 ADA 252\",\"dorsePlaka\":\"03 ADA 256\",\"soforAdi\":\"AYDIN\",\"soforSoyadi\":\"KİREZ\",\"iletisim\":\"0532 394 73 68\",\"tcKimlik\":\"15808378268\",\"kayitTarihi\":\"21.11.2025 12:05:30\",\"kantarPersoneli\":\"Burak Karataş\",\"kayitDateKey\":\"2025-11-21\",\"printCount\":0,\"lastPrintedAt\":0},{\"id\":\"1763077412170\",\"cekiciPlaka\":\"03 AFB 814\",\"dorsePlaka\":\"06 DDE 379\",\"soforAdi\":\"RAMAZAN\",\"soforSoyadi\":\"ARIK\",\"iletisim\":\"0545 420 01 76\",\"tcKimlik\":\"12487488608\",\"kayitTarihi\":\"14.11.2025 02:43:32\",\"kantarPersoneli\":\"Burak Karataş\",\"kayitDateKey\":\"2025-11-14\",\"printCount\":0,\"lastPrintedAt\":0},{\"id\":\"1763155643296\",\"cekiciPlaka\":\"43 NU 471\",\"dorsePlaka\":\"43 NU 472\",\"soforAdi\":\"ŞAHİN\",\"soforSoyadi\":\"UZUN\",\"iletisim\":\"0533 816 29 95\",\"tcKimlik\":\"15128598964\",\"kayitTarihi\":\"15.11.2025 00:27:23\",\"kantarPersoneli\":\"Burak Karataş\",\"kayitDateKey\":\"2025-11-15\",\"printCount\":0,\"lastPrintedAt\":0},{\"id\":\"1763075262762\",\"cekiciPlaka\":\"43 AHB 272\",\"dorsePlaka\":\"43 ACP 878\",\"soforAdi\":\"BÜNYAMİN\",\"soforSoyadi\":\"GAVAŞ\",\"iletisim\":\"0555 195 57 52\",\"tcKimlik\":\"26513331868\",\"kayitTarihi\":\"14.11.2025 02:07:42\",\"kantarPersoneli\":\"Burak Karataş\",\"kayitDateKey\":\"2025-11-14\",\"printCount\":0,\"lastPrintedAt\":0},{\"id\":\"1763704162805\",\"cekiciPlaka\":\"43 AFL 040\",\"dorsePlaka\":\"43 NR 525\",\"soforAdi\":\"İSMAİL\",\"soforSoyadi\":\"ERSÖZ\",\"iletisim\":\"0530 326 29 98\",\"tcKimlik\":\"47812504562\",\"kayitTarihi\":\"21.11.2025 08:49:22\",\"kantarPersoneli\":\"Burak Karataş\",\"kayitDateKey\":\"2025-11-21\",\"printCount\":0,\"lastPrintedAt\":0},{\"id\":\"1763077913842\",\"cekiciPlaka\":\"43 ACS 291\",\"dorsePlaka\":\"43 US 868\",\"soforAdi\":\"ADNAN\",\"soforSoyadi\":\"GÖK\",\"iletisim\":\"0542 809 09 53\",\"tcKimlik\":\"47362518736\",\"kayitTarihi\":\"14.11.2025 02:51:53\",\"kantarPersoneli\":\"Burak Karataş\",\"kayitDateKey\":\"2025-11-14\",\"printCount\":0,\"lastPrintedAt\":0},{\"id\":\"1764211648953\",\"cekiciPlaka\":\"43 ABV 922\",\"dorsePlaka\":\"43 ACE 205\",\"soforAdi\":\"AHMET\",\"soforSoyadi\":\"KOCAMAN\",\"iletisim\":\"0541 8